Title,Date,Authors,Abstract
scPred: accurate supervised method for cell-type classification from single-cell RNA-seq data.,2019-Dec-12,"Jose Alquicira-Hernandez, Anuja Sathe, Hanlee P Ji, Quan Nguyen, Joseph E Powell","Single-cell RNA sequencing has enabled the characterization of highly specific cell types in many tissues, as well as both primary and stem cell-derived cell lines. An important facet of these studies is the ability to identify the transcriptional signatures that define a cell type or state. In theory, this information can be used to classify an individual cell based on its transcriptional profile. Here, we present scPred, a new generalizable method that is able to provide highly accurate classification of single cells, using a combination of unbiased feature selection from a reduced-dimension space, and machine-learning probability-based prediction method. We apply scPred to scRNA-seq data from pancreatic tissue, mononuclear cells, colorectal tumor biopsies, and circulating dendritic cells and show that scPred is able to classify individual cells with high accuracy. The generalized method is available at https://github.com/powellgenomicslab/scPred/."
Discovering patient groups in sequential electronic healthcare data using unsupervised representation learning.,2025-Jan-28,"Jingteng Li, Kimberley R Zakka, John Booth, Louise Rigny, Samiran Ray, Mario Cortina-Borja, Payam Barnaghi, Neil Sebire",Unsupervised feature learning methods inspired by natural language processing (NLP) models are capable of constructing patient-specific features from longitudinal Electronic Health Records (EHR).
Topological Data Analysis for Eye Fundus Image Quality Assessment.,2021-Jul-23,"Gener José Avilés-Rodríguez, Juan Iván Nieto-Hipólito, María de Los Ángeles Cosío-León, Gerardo Salvador Romo-Cárdenas, Juan de Dios Sánchez-López, Patricia Radilla-Chávez, Mabel Vázquez-Briseño","The objective of this work is to perform image quality assessment (IQA) of eye fundus images in the context of digital fundoscopy with topological data analysis (TDA) and machine learning methods. Eye health remains inaccessible for a large amount of the global population. Digital tools that automize the eye exam could be used to address this issue. IQA is a fundamental step in digital fundoscopy for clinical applications; it is one of the first steps in the preprocessing stages of computer-aided diagnosis (CAD) systems using eye fundus images. Images from the EyePACS dataset were used, and quality labels from previous works in the literature were selected. Cubical complexes were used to represent the images; the grayscale version was, then, used to calculate a persistent homology on the simplex and represented with persistence diagrams. Then, 30 vectorized topological descriptors were calculated from each image and used as input to a classification algorithm. Six different algorithms were tested for this study (SVM, decision tree, k-NN, random forest, logistic regression (LoGit), MLP). LoGit was selected and used for the classification of all images, given the low computational cost it carries. Performance results on the validation subset showed a global accuracy of 0.932, precision of 0.912 for label ""quality"" and 0.952 for label ""no quality"", recall of 0.932 for label ""quality"" and 0.912 for label ""no quality"", AUC of 0.980, F1 score of 0.932, and a Matthews correlation coefficient of 0.864. This work offers evidence for the use of topological methods for the process of quality assessment of eye fundus images, where a relatively small vector of characteristics (30 in this case) can enclose enough information for an algorithm to yield classification results useful in the clinical settings of a digital fundoscopy pipeline for CAD."
Detection of Suicide Risk Using Vocal Characteristics: Systematic Review.,2022-Dec-22,"Ravi Iyer, Denny Meyer","In an age when telehealth services are increasingly being used for forward triage, there is a need for accurate suicide risk detection. Vocal characteristics analyzed using artificial intelligence are now proving capable of detecting suicide risk with accuracies superior to traditional survey-based approaches, suggesting an efficient and economical approach to ensuring ongoing patient safety."
The Application of Machine Learning in Doping Detection.,2024-Dec-09,"Qingqing Yang, Wennuo Xu, Xiaodong Sun, Qin Chen, Bing Niu","Detecting doping agents in sports poses a significant challenge due to the continuous emergence of new prohibited substances and methods. Traditional detection methods primarily rely on targeted analysis, which is often labor-intensive and is susceptible to errors. In response, machine learning offers a transformative approach to enhancing doping screening and detection. With its powerful data analysis capabilities, machine learning enables the rapid identification of patterns and features in complex compound data, increasing both the efficiency and the accuracy of detection. Moreover, when integrated with nontargeted metabolomics, machine learning can predict unknown metabolites, aiding the discovery of long-lasting biomarkers of doping. It also excels in classifying novel compounds, thereby reducing false-negative rates. As instrumental analysis and machine learning technologies continue to advance, the development of rapid, scalable, and highly efficient doping detection methods becomes increasingly feasible, supporting the pursuit of fairness and integrity in sports competitions."
Modelling the dynamics of expiratory airflow to describe chronic obstructive pulmonary disease.,2014-Dec,"Marko Topalovic, Vasileios Exadaktylos, Marc Decramer, Thierry Troosters, Daniel Berckmans, Wim Janssens","Chronic obstructive pulmonary disease (COPD) is characterized by expiratory airflow limitation, but current diagnostic criteria only consider flow till the first second and are therefore strongly debated. We aimed to develop a data-based individualized model for flow decline and to explore the relationship between model parameters and COPD presence. A second-order transfer function model was chosen and the model parameters (namely the two poles and the steady state gain (SSG)) from 474 individuals were correlated with COPD presence. The capability of the model to predict disease presence was explored using 5 machine learning classifiers and tenfold cross-validation. Median (95% CI) poles in subjects without disease were 0.9868 (0.9858-0.9878) and 0.9333 (0.9256-0.9395), compared with 0.9929 (0.9925-0.9933) and 0.9082 (0.9004-0.9140) in subjects with COPD (p < 0.001 for both poles). A significant difference was also found when analysing the SSG, being lower in COPD group 3.8 (3.5-4.2) compared with 8.2 (7.8-8.7) in subjects without (p < 0.0001). A combination of all three parameters in a support vector machines corresponded with highest sensitivity of 85%, specificity of 98.1% and accuracy of 88.2% to COPD diagnosis. The forced expiration of COPD can be modelled by a second-order system which parameters identify most COPD cases. Our approach offers an additional tool in case FEV1/FVC ratio-based diagnosis is doubted."
Outlier-based detection of unusual patient-management actions: An ICU study.,2016-Dec,"Milos Hauskrecht, Iyad Batal, Charmgil Hong, Quang Nguyen, Gregory F Cooper, Shyam Visweswaran, Gilles Clermont","Medical errors remain a significant problem in healthcare. This paper investigates a data-driven outlier-based monitoring and alerting framework that uses data in the Electronic Medical Records (EMRs) repositories of past patient cases to identify any unusual clinical actions in the EMR of a current patient. Our conjecture is that these unusual clinical actions correspond to medical errors often enough to justify their detection and alerting. Our approach works by using EMR repositories to learn statistical models that relate patient states to patient-management actions. We evaluated this approach on the EMR data for 24,658 intensive care unit (ICU) patient cases. A total of 16,500 cases were used to train statistical models for ordering medications and laboratory tests given the patient state summarizing the patient's clinical history. The models were applied to a separate test set of 8158 ICU patient cases and used to generate alerts. A subset of 240 alerts generated by the models were evaluated and assessed by eighteen ICU clinicians. The overall true positive rates for the alerts (TPARs) ranged from 0.44 to 0.71. The TPAR for medication order alerts specifically ranged from 0.31 to 0.61 and for laboratory order alerts from 0.44 to 0.75. These results support outlier-based alerting as a promising new approach to data-driven clinical alerting that is generated automatically based on past EMR data."
Classification of ECG signal using FFT based improved Alexnet classifier.,2022,"Arun Kumar M, Arvind Chakrapani","Electrocardiograms (ECG) are extensively used for the diagnosis of cardiac arrhythmias. This paper investigates the use of machine learning classification algorithms for ECG analysis and arrhythmia detection. This is a crucial component of a conventional electronic health system, and it frequently necessitates ECG signal reduction for long-term data storage and remote transmission. Signal processing methods must be used to extract the function of the morphological properties of the ECG signal changing with time, which is difficult to discern in the typical visual depiction of the ECG signal. In biomedical research, signal processing and data analysis are commonly employed methodologies. This work proposes the use of an ECG arrhythmia classification method based on Fast Fourier Transform (FFT) for feature extraction and an improved AlexNet classifier to distinguish the difference between four types of arrhythmia conditions that were collected from records. The Convolutional Neural Network (CNN) algorithm's results are compared to those of other algorithms, and the simulation results prove that the proposed technique is more effective for various parameters. The final results of the proposed system show that its ability to find deviations is 20% better than that of traditional systems."
"An Insider Data Leakage Detection Using One-Hot Encoding, Synthetic Minority Oversampling and Machine Learning Techniques.",2021-Sep-27,"Taher Al-Shehari, Rakan A Alsowail","Insider threats are malicious acts that can be carried out by an authorized employee within an organization. Insider threats represent a major cybersecurity challenge for private and public organizations, as an insider attack can cause extensive damage to organization assets much more than external attacks. Most existing approaches in the field of insider threat focused on detecting general insider attack scenarios. However, insider attacks can be carried out in different ways, and the most dangerous one is a data leakage attack that can be executed by a malicious insider before his/her leaving an organization. This paper proposes a machine learning-based model for detecting such serious insider threat incidents. The proposed model addresses the possible bias of detection results that can occur due to an inappropriate encoding process by employing the feature scaling and one-hot encoding techniques. Furthermore, the imbalance issue of the utilized dataset is also addressed utilizing the synthetic minority oversampling technique (SMOTE). Well known machine learning algorithms are employed to detect the most accurate classifier that can detect data leakage events executed by malicious insiders during the sensitive period before they leave an organization. We provide a proof of concept for our model by applying it on CMU-CERT Insider Threat Dataset and comparing its performance with the ground truth. The experimental results show that our model detects insider data leakage events with an AUC-ROC value of 0.99, outperforming the existing approaches that are validated on the same dataset. The proposed model provides effective methods to address possible bias and class imbalance issues for the aim of devising an effective insider data leakage detection system."
Machine Learning EEG to Predict Cognitive Functioning and Processing Speed Over a 2-Year Period in Multiple Sclerosis Patients and Controls.,2018-May,"Hanni Kiiski, Lee Jollans, Seán Ó Donnchadha, Hugh Nolan, Róisín Lonergan, Siobhán Kelly, Marie Claire O'Brien, Katie Kinsella, Jessica Bramham, Teresa Burke, Michael Hutchinson, Niall Tubridy, Richard B Reilly, Robert Whelan","Event-related potentials (ERPs) show promise to be objective indicators of cognitive functioning. The aim of the study was to examine if ERPs recorded during an oddball task would predict cognitive functioning and information processing speed in Multiple Sclerosis (MS) patients and controls at the individual level. Seventy-eight participants (35 MS patients, 43 healthy age-matched controls) completed visual and auditory 2- and 3-stimulus oddball tasks with 128-channel EEG, and a neuropsychological battery, at baseline (month 0) and at Months 13 and 26. ERPs from 0 to 700 ms and across the whole scalp were transformed into 1728 individual spatio-temporal datapoints per participant. A machine learning method that included penalized linear regression used the entire spatio-temporal ERP to predict composite scores of both cognitive functioning and processing speed at baseline (month 0), and months 13 and 26. The results showed ERPs during the visual oddball tasks could predict cognitive functioning and information processing speed at baseline and a year later in a sample of MS patients and healthy controls. In contrast, ERPs during auditory tasks were not predictive of cognitive performance. These objective neurophysiological indicators of cognitive functioning and processing speed, and machine learning methods that can interrogate high-dimensional data, show promise in outcome prediction."
Machine learning method intervention: Determine proper screening tests for vestibular disorders.,2022-Aug,"Yi Du, Lili Ren, Xingjian Liu, Ziming Wu",To evaluate the performance of different vestibular indicators in disease classification based on machine learning method.
Automated categorisation of clinical incident reports using statistical text classification.,2010-Dec,"Mei-Sing Ong, Farah Magrabi, Enrico Coiera",To explore the feasibility of using statistical text classification techniques to automatically categorise clinical incident reports.
EEG channel and feature investigation in binary and multiple motor imagery task predictions.,2024,"Murside Degirmenci, Yilmaz Kemal Yuce, Matjaž Perc, Yalcin Isler","Motor Imagery (MI) Electroencephalography (EEG) signals are non-stationary and dynamic physiological signals which have low signal-to-noise ratio. Hence, it is difficult to achieve high classification accuracy. Although various machine learning methods have already proven useful to that effect, the use of many features and ineffective EEG channels often leads to a complex structure of classifier algorithms. State-of-the-art studies were interested in improving classification performance with complex feature extraction and classification methods by neglecting detailed EEG channel and feature investigation in predicting MI tasks from EEGs. Here, we investigate the effects of the statistically significant feature selection method on four different feature domains (time-domain, frequency-domain, time-frequency domain, and non-linear domain) and their two different combinations to reduce the number of features and classify MI-EEG features by comparing low-dimensional matrices with well-known machine learning algorithms."
Information-Based Boundary Equilibrium Generative Adversarial Networks with Interpretable Representation Learning.,2018,"Junghoon Hah, Woojin Lee, Jaewook Lee, Saerom Park","This paper describes a new image generation algorithm based on generative adversarial network. With an information-theoretic extension to the autoencoder-based discriminator, this new algorithm is able to learn interpretable representations from the input images. Our model not only adversarially minimizes the Wasserstein distance-based losses of the discriminator and generator but also maximizes the mutual information between small subset of the latent variables and the observation. We also train our model with proportional control theory to keep the equilibrium between the discriminator and the generator balanced, and as a result, our generative adversarial network can mitigate the convergence problem. Through the experiments on real images, we validate our proposed method, which can manipulate the generated images as desired by controlling the latent codes of input variables. In addition, the visual qualities of produced images are effectively maintained, and the model can stably converge to the equilibrium. However, our model has a difficulty in learning disentangling factors because our model does not regularize the independence between the interpretable factors. Therefore, in the future, we will develop a generative model that can learn disentangling factors."
Gene selection from microarray data for cancer classification--a machine learning approach.,2005-Feb,"Yu Wang, Igor V Tetko, Mark A Hall, Eibe Frank, Axel Facius, Klaus F X Mayer, Hans W Mewes","A DNA microarray can track the expression levels of thousands of genes simultaneously. Previous research has demonstrated that this technology can be useful in the classification of cancers. Cancer microarray data normally contains a small number of samples which have a large number of gene expression levels as features. To select relevant genes involved in different types of cancer remains a challenge. In order to extract useful gene information from cancer microarray data and reduce dimensionality, feature selection algorithms were systematically investigated in this study. Using a correlation-based feature selector combined with machine learning algorithms such as decision trees, naïve Bayes and support vector machines, we show that classification performance at least as good as published results can be obtained on acute leukemia and diffuse large B-cell lymphoma microarray data sets. We also demonstrate that a combined use of different classification and feature selection approaches makes it possible to select relevant genes with high confidence. This is also the first paper which discusses both computational and biological evidence for the involvement of zyxin in leukaemogenesis."
Machine Learning-Assisted Designing and Screening of Polymers with a High Melting Point: Database Visualization and Synthetic Feasibility Assessment.,2024-Dec-03,"Zaheer Ahmed Dayo, Jiang Guosong, Mohamed A El-Tayeb, Syed Shoaib Ahmad Shah, Sumaira Naeem","In this study, a novel approach leveraging machine learning (ML) techniques for the design and screening of polymers with high melting points is introduced. More than 40 ML models are trained for the prediction of the melting point. One best model is selected for further analysis. 10,000 polymers are generated using an automatic approach. The generated database of polymers is visualized and analyzed to find the hidden trends. Synthetic feasibility assessment is conducted to prioritize candidate polymers for future experimental work. Chemical similarity of chosen polymers is analyzed using cluster analysis and a heatmap. This research contributes to the advancement of polymer design methodologies, offering insights into the development of heat-resistant polymers for a wide range of industrial applications."
Identification and Classification of Images in e-Cigarette-Related Content on TikTok: Unsupervised Machine Learning Image Clustering Approach.,2025,"Juhan Lee, Dhiraj Murthy, Rachel Ouellette, Tanvi Anand, Grace Kong","Previous studies identified e-cigarette content on popular video and image-based social media platforms such as TikTok. While machine learning approaches have been increasingly used with text-based social media data, image-based analysis such as image-clustering has been rarely used on TikTok. Image clustering can identify underlying patterns and structures across large sets of images, enabling more streamlined distillation and analysis of visual data on TikTok. This study used image-clustering approaches to examine e-cigarette-related images on TikTok."
An artificial niche preserves the quiescence of muscle stem cells and enhances their therapeutic efficacy.,2016-Jul,"Marco Quarta, Jamie O Brett, Rebecca DiMarco, Antoine De Morree, Stephane C Boutet, Robert Chacon, Michael C Gibbons, Victor A Garcia, James Su, Joseph B Shrager, Sarah Heilshorn, Thomas A Rando","A promising therapeutic strategy for diverse genetic disorders involves transplantation of autologous stem cells that have been genetically corrected ex vivo. A major challenge in such approaches is a loss of stem cell potency during culture. Here we describe an artificial niche for maintaining muscle stem cells (MuSCs) in vitro in a potent, quiescent state. Using a machine learning method, we identified a molecular signature of quiescence and used it to screen for factors that could maintain mouse MuSC quiescence, thus defining a quiescence medium (QM). We also engineered muscle fibers that mimic the native myofiber of the MuSC niche. Mouse MuSCs maintained in QM on engineered fibers showed enhanced potential for engraftment, tissue regeneration and self-renewal after transplantation in mice. An artificial niche adapted to human cells similarly extended the quiescence of human MuSCs in vitro and enhanced their potency in vivo. Our approach for maintaining quiescence may be applicable to stem cells isolated from other tissues."
Machine Learning Methods for Automated Quantification of Ventricular Dimensions.,2019-Dec,"Mark Schutera, Steffen Just, Jakob Gierten, Ralf Mikut, Markus Reischl, Christian Pylatiuk",Medaka (
Current role of machine learning and radiogenomics in precision neuro-oncology.,2023,"Teresa Perillo, Marco de Giorgi, Umberto Maria Papace, Antonietta Serino, Renato Cuocolo, Andrea Manto","In the past few years, artificial intelligence (AI) has been increasingly used to create tools that can enhance workflow in medicine. In particular, neuro-oncology has benefited from the use of AI and especially machine learning (ML) and radiogenomics, which are subfields of AI. ML can be used to develop algorithms that dynamically learn from available medical data in order to automatically do specific tasks. On the other hand, radiogenomics can identify relationships between tumor genetics and imaging features, thus possibly giving new insights into the pathophysiology of tumors. Therefore, ML and radiogenomics could help treatment tailoring, which is crucial in personalized neuro-oncology. The aim of this review is to illustrate current and possible future applications of ML and radiomics in neuro-oncology."
Neural robust stabilization via event-triggering mechanism and adaptive learning technique.,2018-Jun,"Ding Wang, Derong Liu","The robust control synthesis of continuous-time nonlinear systems with uncertain term is investigated via event-triggering mechanism and adaptive critic learning technique. We mainly focus on combining the event-triggering mechanism with adaptive critic designs, so as to solve the nonlinear robust control problem. This can not only make better use of computation and communication resources, but also conduct controller design from the view of intelligent optimization. Through theoretical analysis, the nonlinear robust stabilization can be achieved by obtaining an event-triggered optimal control law of the nominal system with a newly defined cost function and a certain triggering condition. The adaptive critic technique is employed to facilitate the event-triggered control design, where a neural network is introduced as an approximator of the learning phase. The performance of the event-triggered robust control scheme is validated via simulation studies and comparisons. The present method extends the application domain of both event-triggered control and adaptive critic control to nonlinear systems possessing dynamical uncertainties."
,2021,"Qiufang Liu, Jiaru Li, Bowen Xin, Yuyun Sun, Dagan Feng, Michael J Fulham, Xiuying Wang, Shaoli Song","The accurate assessment of lymph node metastases (LNMs) and the preoperative nodal (N) stage are critical for the precise treatment of patients with gastric cancer (GC). The diagnostic performance, however, of current imaging procedures used for this assessment is sub-optimal. Our aim was to investigate the value of preoperative "
[Technologies for Complex Intelligent Clinical Data Analysis].,2016,"A A Baranov, L S Namazova-Baranova, I V Smirnov, D A Devyatkin, A O Shelmanov, E A Vishneva, E V Antonova, V I Smirnov","The paper presents the system for intelligent analysis of clinical information. Authors describe methods implemented in the system for clinical information retrieval, intelligent diagnostics of chronic diseases, patient's features importance and for detection of hidden dependencies between features. Results of the experimental evaluation of these methods are also presented."
