Title,Date,Authors,Abstract
Preliminary exploration of deep learning-assisted recognition of superior labrum anterior and posterior lesions in shoulder MR arthrography.,2024-Jan,"Ming Ni, Lixiang Gao, Wen Chen, Qiang Zhao, Yuqing Zhao, Chenyu Jiang, Huishu Yuan","MR arthrography (MRA) is the most accurate method for preoperatively diagnosing superior labrum anterior-posterior (SLAP) lesions, but diagnostic results can vary considerably due to factors such as experience. In this study, deep learning was used to facilitate the preliminary identification of SLAP lesions and compared with radiologists of different seniority."
Wearable Inertial Sensors for Daily Activity Analysis Based on Adam Optimization and the Maximum Entropy Markov Model.,2020-May-20,"Sheikh Badar Ud Din Tahir, Ahmad Jalal, Kibum Kim","Advancements in wearable sensors technologies provide prominent effects in the daily life activities of humans. These wearable sensors are gaining more awareness in healthcare for the elderly to ensure their independent living and to improve their comfort. In this paper, we present a human activity recognition model that acquires signal data from motion node sensors including inertial sensors, i.e., gyroscopes and accelerometers. First, the inertial data is processed via multiple filters such as Savitzky-Golay, median and hampel filters to examine lower/upper cutoff frequency behaviors. Second, it extracts a multifused model for statistical, wavelet and binary features to maximize the occurrence of optimal feature values. Then, adaptive moment estimation (Adam) and AdaDelta are introduced in a feature optimization phase to adopt learning rate patterns. These optimized patterns are further processed by the maximum entropy Markov model (MEMM) for empirical expectation and highest entropy, which measure signal variances for outperformed accuracy results. Our model was experimentally evaluated on University of Southern California Human Activity Dataset (USC-HAD) as a benchmark dataset and on an Intelligent Mediasporting behavior (IMSB), which is a new self-annotated sports dataset. For evaluation, we used the ""leave-one-out"" cross validation scheme and the results outperformed existing well-known statistical state-of-the-art methods by achieving an improved recognition accuracy of 91.25%, 93.66% and 90.91% when compared with USC-HAD, IMSB, and Mhealth datasets, respectively. The proposed system should be applicable to man-machine interface domains, such as health exercises, robot learning, interactive games and pattern-based surveillance."
Differential gene regulatory pattern in the human brain from schizophrenia using transcriptomic-causal network.,2020-Oct-21,"Akram Yazdani, Raul Mendez-Giraldez, Azam Yazdani, Michael R Kosorok, Panos Roussos","Common and complex traits are the consequence of the interaction and regulation of multiple genes simultaneously, therefore characterizing the interconnectivity of genes is essential to unravel the underlying biological networks. However, the focus of many studies is on the differential expression of individual genes or on co-expression analysis."
Transformer-based deep learning denoising of single and multi-delay 3D arterial spin labeling.,2024-Feb,"Qinyang Shou, Chenyang Zhao, Xingfeng Shao, Kay Jann, Hosung Kim, Karl G Helmer, Hanzhang Lu, Danny J J Wang",To present a Swin Transformer-based deep learning (DL) model (SwinIR) for denoising single-delay and multi-delay 3D arterial spin labeling (ASL) and compare its performance with convolutional neural network (CNN) and other Transformer-based methods.
Obtaining vertical distribution of PM,2022-Jan-20,"Bin Chen, Zhihao Song, Feng Pan, Yue Huang",Aerosol optical depth (AOD) has been widely used to estimate the near-surface PM
Understandable learning machine system design for transmembrane or embedded membrane segments prediction.,2011,"Hae-Jin Hu, Robert W Harrison, Phang C Tai, Yi Pan",We modified an existing association rule-based classifier CPAR to improve traditional black box model based learning machine approaches on Transmembrane (TM) segment prediction. The modified classifier was improved further by combining with SVM. The experimental results indicate that this hybrid scheme offers biologically meaningful rules on TM/EM segment prediction while maintaining the performance almost as well as the SVM method. The evaluation of the sturdiness and the Receiver Operating Characteristic (ROC) curve analysis proved that this new scheme is robust and competent with SVM on TM/EM segment prediction. The prediction server is available at http://bmcc2.cs.gsu.edu/ haeh2/.
"Protein complexes, big data, machine learning and integrative proteomics: lessons learned over a decade of systematic analysis of protein interaction networks.",2017-Oct,"Pierre C Havugimana, Pingzhao Hu, Andrew Emili","Elucidation of the networks of physical (functional) interactions present in cells and tissues is fundamental for understanding the molecular organization of biological systems, the mechanistic basis of essential and disease-related processes, and for functional annotation of previously uncharacterized proteins (via guilt-by-association or -correlation). After a decade in the field, we felt it timely to document our own experiences in the systematic analysis of protein interaction networks. Areas covered: Researchers worldwide have contributed innovative experimental and computational approaches that have driven the rapidly evolving field of 'functional proteomics'. These include mass spectrometry-based methods to characterize macromolecular complexes on a global-scale and sophisticated data analysis tools - most notably machine learning - that allow for the generation of high-quality protein association maps. Expert commentary: Here, we recount some key lessons learned, with an emphasis on successful workflows, and challenges, arising from our own and other groups' ongoing efforts to generate, interpret and report proteome-scale interaction networks in increasingly diverse biological contexts."
A spheroid whole mount drug testing pipeline with machine-learning based image analysis identifies cell-type specific differences in drug efficacy on a single-cell level.,2024-Dec-18,"Mario Vitacolonna, Roman Bruch, Richard Schneider, Julia Jabs, Mathias Hafner, Markus Reischl, Rüdiger Rudolf","The growth and drug response of tumors are influenced by their stromal composition, both in vivo and 3D-cell culture models. Cell-type inherent features as well as mutual relationships between the different cell types in a tumor might affect drug susceptibility of the tumor as a whole and/or of its cell populations. However, a lack of single-cell procedures with sufficient detail has hampered the automated observation of cell-type-specific effects in three-dimensional stroma-tumor cell co-cultures."
Effects of Unrestricted Kinematically Aligned Total Knee Arthroplasty with a Modified Soft-Tissue Respecting Technique on the Deformity of Limb Alignment in Japanese Patients.,2023-Nov-08,"Masahiro Ishikawa, Masaaki Ishikawa, Hideaki Nagashima, Shinya Ishizuka, Kazuhiko Michishita, Yoshinori Soda, Takafumi Hiranaka",
Consensus based framework for digital mobility monitoring.,2021,"Felix Kluge, Silvia Del Din, Andrea Cereatti, Heiko Gaßner, Clint Hansen, Jorunn L Helbostad, Jochen Klucken, Arne Küderle, Arne Müller, Lynn Rochester, Martin Ullrich, Bjoern M Eskofier, Claudia Mazzà","Digital mobility assessment using wearable sensor systems has the potential to capture walking performance in a patient's natural environment. It enables monitoring of health status and disease progression and evaluation of interventions in real-world situations. In contrast to laboratory settings, real-world walking occurs in non-conventional environments and under unconstrained and uncontrolled conditions. Despite the general understanding, there is a lack of agreed definitions about what constitutes real-world walking, impeding the comparison and interpretation of the acquired data across systems and studies. The goal of this study was to obtain expert-based consensus on specific aspects of real-world walking and to provide respective definitions in a common terminological framework. An adapted Delphi method was used to obtain agreed definitions related to real-world walking. In an online survey, 162 participants from a panel of academic, clinical and industrial experts with experience in the field of gait analysis were asked for agreement on previously specified definitions. Descriptive statistics was used to evaluate whether consent (> 75% agreement as defined a priori) was reached. Of 162 experts invited to participate, 51 completed all rounds (31.5% response rate). We obtained consensus on all definitions (""Walking"" > 90%, ""Purposeful"" > 75%, ""Real-world"" > 90%, ""Walking bout"" > 80%, ""Walking speed"" > 75%, ""Turning"" > 90% agreement) after two rounds. The identification of a consented set of real-world walking definitions has important implications for the development of assessment and analysis protocols, as well as for the reporting and comparison of digital mobility outcomes across studies and systems. The definitions will serve as a common framework for implementing digital and mobile technologies for gait assessment and are an important link for the transition from supervised to unsupervised gait assessment."
Effect of a Machine Learning-Derived Early Warning Tool With Treatment Protocol on Hypotension During Cardiac Surgery and ICU Stay: The Hypotension Prediction 2 (HYPE-2) Randomized Clinical Trial.,2025-Feb-01,"Jaap Schuurmans, Santino R Rellum, Jimmy Schenk, Björn J P van der Ster, Ward H van der Ven, Bart F Geerts, Markus W Hollmann, Thomas G V Cherpanath, Wim K Lagrand, Paul R Wynandts, Frederique Paulus, Antoine H G Driessen, Lotte E Terwindt, Susanne Eberl, Henning Hermanns, Denise P Veelo, Alexander P J Vlaar","Cardiac surgery is associated with perioperative complications, some of which might be attributable to hypotension. The Hypotension Prediction Index (HPI), a machine-learning-derived early warning tool for hypotension, has only been evaluated in noncardiac surgery. We investigated whether using HPI with diagnostic guidance reduced hypotension during cardiac surgery and in the ICU."
Identifying influential factors using machine learning techniques on the intention to receive a COVID-19 booster dose and vaccine fatigue among partially vaccinated individuals.,2024,"Athina Bikaki, Justin M Luningham, Erika L Thompson, Brittany Krenek, Jamboor K Vishwanatha, Ioannis A Kakadiaris","This study assesses COVID-19 booster intentions and hesitancy in Texas, a state known for its diversity and libertarian values. A survey was conducted with 274 participants residing in Texas between June and July 2022. The analysis examined sociodemographic and health-related factors, trusted information sources, and preventive behaviors. The survey focused on vaccinated participants and their intention to receive the booster dose, which was categorized into three outcomes: yes, no, and not sure. Machine learning techniques were employed to analyze the survey responses of vaccinated participants to identify the most critical factors. Among the participants, 113 expressed their intention to get the booster (41.2%), 107 did not plan to receive the booster (39.1%), and 54 remained undecided (19.7%). Our findings indicate that the perception of vaccine safety significantly influenced the decision to receive the booster dose. Those who reported trust in social media contacts as reliable information sources were more likely to intend to boost. Additionally, among those hospitalized when diagnosed with COVID-19, the largest proportion were unwilling to receive the booster (47.0%) compared to those who intended to receive the booster (33.3%). In contrast, most of those who believed they would be hospitalized if infected with COVID-19 intended to get the booster. Other factors did not demonstrate a significant association. Our findings are highly transferable and can offer valuable insights, particularly for countries where COVID-19 remains prevalent and are pivotal both presently and in the future for developing strategies to improve booster uptake and shape public health initiatives in epidemic and pandemic outbreaks."
A survey of recently emerged genome-wide computational enhancer predictor tools.,2018-Jun,"Leonard Whye Kit Lim, Hung Hui Chung, Yee Ling Chong, Nung Kion Lee","The race for the discovery of enhancers at a genome-wide scale has been on since the commencement of next generation sequencing decades after the discovery of the first enhancer, SV40. A few enhancer-predicting features such as chromatin feature, histone modifications and sequence feature had been implemented with varying success rates. However, to date, there is no consensus yet on the single enhancer marker that can be employed to ultimately distinguish and uncover enhancers from the enormous genomic regions. Many supervised, unsupervised and semi-supervised computational approaches had emerged to complement and facilitate experimental approaches in enhancer discovery. In this review, we placed our focus on the recently emerged enhancer predictor tools that work on general enhancer features such as sequences, chromatin states and histone modifications, eRNA and of multiple feature approach. Comparisons of their prediction methods and outcomes were done across their functionally similar counterparts. We provide some recommendations and insights for future development of more comprehensive and robust tools."
Tailored point-of-care biosensors for liquid biopsy in the field of oncology.,2022-Dec-20,"Sima Singh, Pritam Saha Podder, Matt Russo, Charles Henry, Stefano Cinti","In the field of cancer detection, technologies to analyze tumors using biomarkers circulating in fluids such as blood have developed rapidly based on liquid biopsy. A proactive approach to early cancer detection can lead to more effective treatments with minimal side effects and better long-term patient survival. However, early detection of cancer is hindered by the existing limitations of conventional cancer diagnostic methods. To enable early diagnosis and regular monitoring and improve automation, the development of integrated point-of-care (POC) and biosensors is needed. This is expected to fundamentally change the diagnosis, management, and monitoring of response to treatment of cancer. POC-based techniques will provide a way to avoid complications that occur after invasive tissue biopsy, such as bleeding, infection, and pain. The aim of this study is to provide a comprehensive view of biosensors and their clinical relevance in oncology for the detection of biomarkers with liquid biopsies of proteins, miRNA, ctDNA, exosomes, and cancer cells. The preceding discussion also illustrates the changing landscape of liquid biopsy-based cancer diagnosis through nanomaterials, machine learning, artificial intelligence, wearable devices, and sensors, many of which apply POC design principles. With the advent of sensitive, selective, and timely detection of cancer, we see the field of POC technology for cancer detection and treatment undergoing a positive paradigm shift in the foreseeable future."
Application of visible and near infrared hyperspectral imaging for non-invasively measuring distribution of water-holding capacity in salmon flesh.,2013-Nov-15,"Di Wu, Da-Wen Sun","Water-holding capacity (WHC) is a primary quality determinant of salmon flesh. One of the limiting factors for not having a direct measurement of WHC for salmon quality grading is that current WHC measurements are destructive, time-consuming, and inefficient. In this study, two hyperspectral image systems operated in the visible and short-wave near infrared range (400-1000 nm) and the long-wave near infrared range (897-1753 nm) were applied for non-invasive determination of four WHC indices, namely percentage liquid loss (PLL), percentage water loss (PWL), percentage fat loss (PFL), and percentage water remained (PWR) of salmon flesh. Two calibration methods of partial least square regression (PLSR) and least-squares support vector machines (LS-SVM) were applied, respectively, to establish calibration models of WHC indices based on the spectral signatures of salmon flesh, and the performances of these two methods were compared to determine the optimal spectral calibration strategy. The performances were also compared between two hyperspectral image systems, when full range spectra were considered. Out of 121 wavelength variables, only thirteen (PLL), twelve (PWL), nine (PFL), and twelve variables (PWR) were selected as important variables by using competitive adaptive reweighted sampling (CARS) algorithm to reduce redundancy and collinearity of hyperspectral images. The CARS-PLSR combination was identified as the optimal method to calibrate the prediction models for WHC determination, resulting in good correlation coefficient of prediction (rP) of 0.941, 0.937, 0.815, and 0.970 for PLL, PWL, PFL, and PWR analysis, respectively. CARS-PLSR equations were obtained according to the regression coefficients of the CARS-PLSR models and were transferred to each pixel in the image for visualizing WHC indices in all portions of the salmon fillet. The overall results show that the laborious, time-consuming, and destructive traditional techniques could be replaced by hyperspectral imaging to provide a rapid and non-invasive measurement of WHC distribution in salmon flesh."
Machine-Learning Models: The Future of Predictive Analytics in Neurosurgery.,2018-Jul-01,"G Damian Brusko, John Paul G Kolcun, Michael Y Wang",No abstract available
Assessing greenspace and cardiovascular health through deep-learning analysis of street-view imagery in a cohort of US children.,2025-Jan-15,"Li Yi, Sheryl Rifas-Shiman, Marcia Pescador Jimenez, Pi-I Debby Lin, Esra Suel, Perry Hystad, Andrew Larkin, Steve Hankey, Wenwen Zhang, Jochem Klompmaker, Emily Oken, Marie-France Hivert, Izzuddin Aris, Peter James","Accurately capturing individuals' experiences with greenspace at ground-level can provide valuable insights into their impact on children's health. However, most previous research has relied on coarse satellite-based measurements."
Unsupervised learning of spatially-resolved ARPES spectra for epitaxially grown graphene via non-negative matrix factorization.,2024-Oct-15,"Masaki Imamura, Kazutoshi Takahashi","This study proposed an unsupervised machine-learning approach for analyzing spatially-resolved ARPES. A combination of non-negative matrix factorization (NMF) and k-means clustering was applied to spatially-resolved ARPES spectra of the graphene epitaxially grown on a SiC substrate. The Dirac cones of graphene were decomposed and reproduced fairly well using NMF. The base and activation matrices obtained from the NMF results reflected the detailed spectral features derived from the number of graphene layers and growth directions. The spatial distribution of graphene thickness on the substrate was clearly visualized by the clustering using the activation matrices acquired via NMF. Integration with k-means clustering enables clear visualization of spatial variations. Our method efficiently handles large datasets, extracting spectral features without manual inspection. It offers broad applicability beyond graphene studies to analyze ARPES spectra in various materials."
Dependency-based Siamese long short-term memory network for learning sentence representations.,2018,"Wenhao Zhu, Tengjun Yao, Jianyue Ni, Baogang Wei, Zhiguo Lu","Textual representations play an important role in the field of natural language processing (NLP). The efficiency of NLP tasks, such as text comprehension and information extraction, can be significantly improved with proper textual representations. As neural networks are gradually applied to learn the representation of words and phrases, fairly efficient models of learning short text representations have been developed, such as the continuous bag of words (CBOW) and skip-gram models, and they have been extensively employed in a variety of NLP tasks. Because of the complex structure generated by the longer text lengths, such as sentences, algorithms appropriate for learning short textual representations are not applicable for learning long textual representations. One method of learning long textual representations is the Long Short-Term Memory (LSTM) network, which is suitable for processing sequences. However, the standard LSTM does not adequately address the primary sentence structure (subject, predicate and object), which is an important factor for producing appropriate sentence representations. To resolve this issue, this paper proposes the dependency-based LSTM model (D-LSTM). The D-LSTM divides a sentence representation into two parts: a basic component and a supporting component. The D-LSTM uses a pre-trained dependency parser to obtain the primary sentence information and generate supporting components, and it also uses a standard LSTM model to generate the basic sentence components. A weight factor that can adjust the ratio of the basic and supporting components in a sentence is introduced to generate the sentence representation. Compared with the representation learned by the standard LSTM, the sentence representation learned by the D-LSTM contains a greater amount of useful information. The experimental results show that the D-LSTM is superior to the standard LSTM for sentences involving compositional knowledge (SICK) data."
Head and Neck Cancer Tumor Segmentation Using Support Vector Machine in Dynamic Contrast-Enhanced MRI.,2017,"Wei Deng, Liangping Luo, Xiaoyi Lin, Tianqi Fang, Dexiang Liu, Guo Dan, Hanwei Chen",We aimed to propose an automatic method based on Support Vector Machine (SVM) and Dynamic Contrast-Enhanced Magnetic Resonance Imaging (DCE-MRI) to segment the tumor lesions of head and neck cancer (HNC).
Optimizing methadone dose adjustment in patients with opioid use disorder.,2023,"Po-Shen Liu, Teng-Yao Kuo, I-Chun Chen, Shu-Wua Lee, Ting-Gang Chang, Hou-Liang Chen, Jun-Peng Chen",Opioid use disorder is a cause for concern globally. This study aimed to optimize methadone dose adjustments using mixed modeling and machine learning.
Analysis and prediction of COVID-19 trajectory: A machine learning approach.,2021-Nov,"Ritanjali Majhi, Rahul Thangeda, Renu Prasad Sugasi, Niraj Kumar","The outbreak of Coronavirus 2019 (COVID-19) has impacted everyday lives globally. The number of positive cases is growing and India is now one of the most affected countries. This paper builds predictive models that can predict the number of positive cases with higher accuracy. Regression-based, Decision tree-based, and Random forest-based models have been built on the data from China and are validated on India's sample. The model is found to be effective and will be able to predict the positive number of cases in the future with minimal error. The developed machine learning model can work in real-time and can effectively predict the number of positive cases. Key measures and suggestions have been put forward considering the effect of lockdown."
Development of a Mouse Pain Scale Using Sub-second Behavioral Mapping and Statistical Modeling.,2019-Aug-06,"Ishmail Abdus-Saboor, Nathan T Fried, Mark Lay, Justin Burdge, Kathryn Swanson, Roman Fischer, Jessica Jones, Peter Dong, Weihua Cai, Xinying Guo, Yuan-Xiang Tao, John Bethea, Minghong Ma, Xinzhong Dong, Long Ding, Wenqin Luo","Rodents are the main model systems for pain research, but determining their pain state is challenging. To develop an objective method to assess pain sensation in mice, we adopt high-speed videography to capture sub-second behavioral features following hind paw stimulation with both noxious and innocuous stimuli and identify several differentiating parameters indicating the affective and reflexive aspects of nociception. Using statistical modeling and machine learning, we integrate these parameters into a single index and create a ""mouse pain scale,"" which allows us to assess pain sensation in a graded manner for each withdrawal. We demonstrate the utility of this method by determining sensations triggered by three different von Frey hairs and optogenetic activation of two different nociceptor populations. Our behavior-based ""pain scale"" approach will help improve the rigor and reproducibility of using withdrawal reflex assays to assess pain sensation in mice."
