Title,Date,Authors,Abstract
Physics-informed machine learning and its structural integrity applications: state of the art.,2023-Nov-13,"Shun-Peng Zhu, Lanyi Wang, Changqi Luo, José A F O Correia, Abílio M P De Jesus, Filippo Berto, Qingyuan Y Wang","The development of machine learning (ML) provides a promising solution to guarantee the structural integrity of critical components during service period. However, considering the lack of respect for the underlying physical laws, the data hungry nature and poor extrapolation performance, the further application of pure data-driven methods in structural integrity is challenged. An emerging ML paradigm, physics-informed machine learning (PIML), attempts to overcome these limitations by embedding physical information into ML models. This paper discusses different ways of embedding physical information into ML and reviews the developments of PIML in structural integrity including failure mechanism modelling and prognostic and health management (PHM). The exploration of the application of PIML to structural integrity demonstrates the potential of PIML for improving consistency with prior knowledge, extrapolation performance, prediction accuracy, interpretability and computational efficiency and reducing dependence on training data. The analysis and findings of this work outline the limitations at this stage and provide some potential research direction of PIML to develop advanced PIML for ensuring structural integrity of engineering systems/facilities. This article is part of the theme issue 'Physics-informed machine learning and its structural integrity applications (Part 1)'."
GAHLS: an optimized graph analytics based high level synthesis framework.,2023-Dec-19,"Yao Xiao, Shahin Nazarian, Paul Bogdan","The urgent need for low latency, high-compute and low power on-board intelligence in autonomous systems, cyber-physical systems, robotics, edge computing, evolvable computing, and complex data science calls for determining the optimal amount and type of specialized hardware together with reconfigurability capabilities. With these goals in mind, we propose a novel comprehensive graph analytics based high level synthesis (GAHLS) framework that efficiently analyzes complex high level programs through a combined compiler-based approach and graph theoretic optimization and synthesizes them into message passing domain-specific accelerators. This GAHLS framework first constructs a compiler-assisted dependency graph (CaDG) from low level virtual machine (LLVM) intermediate representation (IR) of high level programs and converts it into a hardware friendly description representation. Next, the GAHLS framework performs a memory design space exploration while account for the identified computational properties from the CaDG and optimizing the system performance for higher bandwidth. The GAHLS framework also performs a robust optimization to identify the CaDG subgraphs with similar computational structures and aggregate them into intelligent processing clusters in order to optimize the usage of underlying hardware resources. Finally, the GAHLS framework synthesizes this compressed specialized CaDG into processing elements while optimizing the system performance and area metrics. Evaluations of the GAHLS framework on several real-life applications (e.g., deep learning, brain machine interfaces) demonstrate that it provides 14.27× performance improvements compared to state-of-the-art approaches such as LegUp 6.2."
A shot taxonomy in the era of tracking data in professional tennis.,2018-Sep,"Stephanie Kovalchik, Machar Reid","Shots are an essential part of the language of tennis yet little is known about the distinct types of shots in the professional game. In this study, we build a taxonomy of shots for elite tennis players using tracking data from multiple years of men's and women's matches at the Australian Open. Our taxonomy is constructed using model-based multi-stage functional data clustering, an unsupervised machine learning approach. Among 270,023 men's and 178,136 women's shots, we found 13 distinct types of serves to both the Ad and Deuce court for male players and 17 and 15 types to the Ad and Deuce for female players. More variety was found among serve returns and rally shots compared to the serve; with less variety on the backhand than forehand. There was also more overlap in the physical characteristics of groundstroke shots between male and female players than on serve. Shot type was strongly associated with winning points and shots in the highest speed and lowest net clearance categories tended to be the most effective. This data-driven dictionary of shots provides a framework for analysis of elite player performance, characterizing playing style, and designing more representative practice."
Integrative Analysis of Pharmacology and Transcriptomics Predicts Resveratrol Will Ameliorate Microplastics-Induced Lung Damage by Targeting Ccl2 and Esr1.,2024-Dec-14,"Yadong Zhang, Jingyi Ren, Siqi Zhu, Zihao Guo, Huanting Pei, Xiaoya Sun, Jiarui Wu, Weijie Yang, Jinshi Zuo, Yuxia Ma","Microplastics (MPs) are ubiquitous on earth, posing a growing threat to human health. Previous studies have shown that the lung is a primary organ for MPs exposure. Resveratrol (RES) is a common dietary polyphenol that exhibits anti-inflammatory and antioxidant effects. However, whether RES exerts a protective effect against MPs-induced lung damage is still unknown."
Development of a depression in Parkinson's disease prediction model using machine learning.,2020-Oct-19,Haewon Byeon,It is important to diagnose depression in Parkinson's disease (DPD) as soon as possible and identify the predictors of depression to improve quality of life in Parkinson's disease (PD) patients.
The Impact of Pretrained Language Models on Negation and Speculation Detection in Cross-Lingual Medical Text: Comparative Study.,2020-Dec-03,"Renzo Rivera Zavala, Paloma Martinez","Negation and speculation are critical elements in natural language processing (NLP)-related tasks, such as information extraction, as these phenomena change the truth value of a proposition. In the clinical narrative that is informal, these linguistic facts are used extensively with the objective of indicating hypotheses, impressions, or negative findings. Previous state-of-the-art approaches addressed negation and speculation detection tasks using rule-based methods, but in the last few years, models based on machine learning and deep learning exploiting morphological, syntactic, and semantic features represented as spare and dense vectors have emerged. However, although such methods of named entity recognition (NER) employ a broad set of features, they are limited to existing pretrained models for a specific domain or language."
Research on hybrid intrusion detection method based on the ADASYN and ID3 algorithms.,2022-Jan,"Yue Li, Wusheng Xu, Wei Li, Ang Li, Zengjin Liu","Intrusion detection system plays an important role in network security. Early detection of the potential attacks can prevent the further network intrusion from adversaries. To improve the effectiveness of the intrusion detection rate, this paper proposes a hybrid intrusion detection method that utilizes ADASYN (Adaptive Synthetic) and the decision tree based on ID3 algorithm. At first, the intrusion detection dataset is transformed by coding technology and normalized. Subsequently, the ADASYN algorithm is applied to implement oversampling on the training set, and the ID3 algorithm is employed to build a decision tree model. In addition, the model proposed by the research is evaluated by accuracy, precision, recall, and false alarm rate. Besides, a performance comparison is conducted with other models. Consequently, it is found that the combined model based on ADASYN and ID3 decision tree proposed in this research possesses higher accuracy as well as lower false alarm rate, which is more suitable for intrusion detection tasks."
Modeling the adsorption of PAH mixture in silica nanopores by molecular dynamic simulation combined with machine learning.,2016-Feb,"Hong Sui, Lin Li, Xinzhe Zhu, Daoyi Chen, Guozhong Wu","The persistence of polycyclic aromatic hydrocarbons (PAHs) in contaminated soils is largely controlled by their molecular fate in soil pores. The adsorption and diffusion of 16 PAHs mixture in silica nanopore with diameter of 2.0, 2.5, 3.0 and 3.5 nm, respectively, were characterized by adsorption energy, mean square displacement, free surface area and free volume fraction using molecular dynamic (MD) simulation. Results suggested that PAHs adsorption in silica nanopores was associated with diffusion process while competitive sorption was not the dominant mechanism in context of this study. The partial least squares (PLS) regression and machine learning (ML) methods (i.e. support vector regression, M5 decision tree and multilayer perceptrons) were used to correlate the adsorption energy with the pore diameter and PAH properties (number of carbon atoms, aromatic ring number, boiling point, molecular weight, octanol-water partition coefficient, octanol-organic carbon partition coefficient, solvent accessible area, solvent accessible volume and polarization). Results indicated that the PAH adsorption could not be predicted by linear regression as the R(2)Y and Q(2)Y coefficients of PLS analysis was 0.375 and 0.199, respectively. The nonlinearity was well recognized by ML with correlation coefficient up to 0.9. Overall, the combination of MD simulation and ML approaches can assist in interpreting the sequestration of organic contaminants in the soil nanopores."
Current Trends of Raman Spectroscopy in Clinic Settings: Opportunities and Challenges.,2024-Feb,"Yumei Wang, Liuru Fang, Yuhua Wang, Zuzhao Xiong","Early clinical diagnosis, effective intraoperative guidance, and an accurate prognosis can lead to timely and effective medical treatment. The current conventional clinical methods have several limitations. Therefore, there is a need to develop faster and more reliable clinical detection, treatment, and monitoring methods to enhance their clinical applications. Raman spectroscopy is noninvasive and provides highly specific information about the molecular structure and biochemical composition of analytes in a rapid and accurate manner. It has a wide range of applications in biomedicine, materials, and clinical settings. This review primarily focuses on the application of Raman spectroscopy in clinical medicine. The advantages and limitations of Raman spectroscopy over traditional clinical methods are discussed. In addition, the advantages of combining Raman spectroscopy with machine learning, nanoparticles, and probes are demonstrated, thereby extending its applicability to different clinical phases. Examples of the clinical applications of Raman spectroscopy over the last 3 years are also integrated. Finally, various prospective approaches based on Raman spectroscopy in clinical studies are surveyed, and current challenges are discussed."
Low-Dose CT Image Denoising Using a Generative Adversarial Network With Wasserstein Distance and Perceptual Loss.,2018-Jun,"Qingsong Yang, Pingkun Yan, Yanbo Zhang, Hengyong Yu, Yongyi Shi, Xuanqin Mou, Mannudeep K Kalra, Yi Zhang, Ling Sun, Ge Wang","The continuous development and extensive use of computed tomography (CT) in medical practice has raised a public concern over the associated radiation dose to the patient. Reducing the radiation dose may lead to increased noise and artifacts, which can adversely affect the radiologists' judgment and confidence. Hence, advanced image reconstruction from low-dose CT data is needed to improve the diagnostic performance, which is a challenging problem due to its ill-posed nature. Over the past years, various low-dose CT methods have produced impressive results. However, most of the algorithms developed for this application, including the recently popularized deep learning techniques, aim for minimizing the mean-squared error (MSE) between a denoised CT image and the ground truth under generic penalties. Although the peak signal-to-noise ratio is improved, MSE- or weighted-MSE-based methods can compromise the visibility of important structural details after aggressive denoising. This paper introduces a new CT image denoising method based on the generative adversarial network (GAN) with Wasserstein distance and perceptual similarity. The Wasserstein distance is a key concept of the optimal transport theory and promises to improve the performance of GAN. The perceptual loss suppresses noise by comparing the perceptual features of a denoised output against those of the ground truth in an established feature space, while the GAN focuses more on migrating the data noise distribution from strong to weak statistically. Therefore, our proposed method transfers our knowledge of visual perception to the image denoising task and is capable of not only reducing the image noise level but also trying to keep the critical information at the same time. Promising results have been obtained in our experiments with clinical CT images."
Image-based state-of-the-art techniques for the identification and classification of brain diseases: a review.,2020-Nov,"Ejaz Ul Haq, Jianjun Huang, Li Kang, Hafeez Ul Haq, Tijiang Zhan","Detection and classification methods have a vital and important role in identifying brain diseases. Timely detection and classification of brain diseases enable an accurate identification and effective management of brain impairment. Brain disorders are commonly most spreadable diseases and the diagnosing process is time-consuming and highly expensive. There is an utmost need to develop effective and advantageous methods for brain diseases detection and characterization. Magnetic resonance imaging (MRI), computed tomography (CT), and other various brain imaging scans are used to identify different brain diseases and disorders. Brain imaging scans are the efficient tool to understand the anatomical changes in brain in fast and accurate manner. These different brain imaging scans used with segmentation techniques and along with machine learning and deep learning techniques give maximum accuracy and efficiency. This paper focuses on different conventional approaches, machine learning and deep learning techniques used for the detection, and classification of brain diseases and abnormalities. This paper also summarizes the research gap and problems in the existing techniques used for detection and classification of brain disorders. Comparison and evaluation of different machine learning and deep learning techniques in terms of efficiency and accuracy are also highlighted in this paper. Furthermore, different brain diseases like leukoariaosis, Alzheimer's, Parkinson's, and Wilson's disorder are studied in the scope of machine learning and deep learning techniques."
Sequence Prediction With Sparse Distributed Hyperdimensional Coding Applied to the Analysis of Mobile Phone Use Patterns.,2016-Sep,"Okko J Rasanen, Jukka P Saarinen","Modeling and prediction of temporal sequences is central to many signal processing and machine learning applications. Prediction based on sequence history is typically performed using parametric models, such as fixed-order Markov chains ( n -grams), approximations of high-order Markov processes, such as mixed-order Markov models or mixtures of lagged bigram models, or with other machine learning techniques. This paper presents a method for sequence prediction based on sparse hyperdimensional coding of the sequence structure and describes how higher order temporal structures can be utilized in sparse coding in a balanced manner. The method is purely incremental, allowing real-time online learning and prediction with limited computational resources. Experiments with prediction of mobile phone use patterns, including the prediction of the next launched application, the next GPS location of the user, and the next artist played with the phone media player, reveal that the proposed method is able to capture the relevant variable-order structure from the sequences. In comparison with the n -grams and the mixed-order Markov models, the sparse hyperdimensional predictor clearly outperforms its peers in terms of unweighted average recall and achieves an equal level of weighted average recall as the mixed-order Markov chain but without the batch training of the mixed-order model."
Computer-aided detection of brain metastasis on 3D MR imaging: Observer performance study.,2017,"Leonard Sunwoo, Young Jae Kim, Seung Hong Choi, Kwang-Gi Kim, Ji Hee Kang, Yeonah Kang, Yun Jung Bae, Roh-Eul Yoo, Jihang Kim, Kyong Joon Lee, Seung Hyun Lee, Byung Se Choi, Cheolkyu Jung, Chul-Ho Sohn, Jae Hyoung Kim",To assess the effect of computer-aided detection (CAD) of brain metastasis (BM) on radiologists' diagnostic performance in interpreting three-dimensional brain magnetic resonance (MR) imaging using follow-up imaging and consensus as the reference standard.
Staging of cervical cancer based on tumor heterogeneity characterized by texture features on (18)F-FDG PET images.,2015-Jul-07,"Wei Mu, Zhe Chen, Ying Liang, Wei Shen, Feng Yang, Ruwei Dai, Ning Wu, Jie Tian","The aim of the study is to assess the staging value of the tumor heterogeneity characterized by texture features and other commonly used semi-quantitative indices extracted from (18)F-FDG PET images of cervical cancer (CC) patients. Forty-two patients suffering CC at different stages were enrolled in this study. Firstly, we proposed a new tumor segmentation method by combining the intensity and gradient field information in a level set framework. Secondly, fifty-four 3D texture features were studied besides of SUVs (SUVmax, SUVmean, SUVpeak) and metabolic tumor volume (MTV). Through correlation analysis, receiver-operating-characteristic (ROC) curves analysis, some independent indices showed statistically significant differences between the early stage (ES, stages I and II) and the advanced stage (AS, stages III and IV). Then the tumors represented by those independent indices could be automatically classified into ES and AS, and the most discriminative feature could be chosen. Finally, the robustness of the optimal index with respect to sampling schemes and the quality of the PET images were validated. Using the proposed segmentation method, the dice similarity coefficient and Hausdorff distance were 91.78   ±   1.66% and 7.94   ±   1.99 mm, respectively. According to the correlation analysis, all the fifty-eight indices could be divided into 20 groups. Six independent indices were selected for their highest areas under the ROC curves (AUROC), and showed significant differences between ES and AS (P  <  0.05). Through automatic classification with the support vector machine (SVM) Classifier, run percentage (RP) was the most discriminative index with the higher accuracy (88.10%) and larger AUROC (0.88). The Pearson correlation of RP under different sampling schemes is 0.9991   ±   0.0011. RP is a highly stable feature and well correlated with tumor stage in CC, which suggests it could differentiate ES and AS with high accuracy."
Voice Disorder Classifications: A Scoping Review - Part A.,2022-Dec-03,"Ana Carolina Constantini, Vanessa Veis Ribeiro, Mara Behlau","Voice is a complex and multidimensional phenomenon of interest to different disciplines. Divergent terminologies and, consequently, classification systems constitute, historically, a difficulty in this field of knowledge, which limits communication between professionals from different countries, backgrounds, and clinical experiences, and well as limiting clinical management and discussion of scientific research findings. This article aims to map and analyze the different diagnostic classifications in voice by describing the findings of a scoping review, consisting of both electronic and manual searches. The results are presented in two parts. In Part A of this article, we explore propositions for comprehensive diagnostic classifications, which involve theoretical frameworks for the constitution of each proposal. The included studies were classified as either articles with theoretical propositions, called G1, or articles using automated computerized classification systems called G2. A total of 44 articles were included: 27 in G1 and 17 in G2. In G1, we found studies from 1947 to 2021, most of which were from the USA, the authors having created theoretical propositions on the subject, considering mainly the etiology of vocal disorder. In G2, we found studies from 2009 onwards, emphasizing automated extraction of acoustic measurements and machine learning to create classification systems. G1 shows the propositions of classifications ranging from two to 11 main groups, each with possible subgroups. In G2, the classifications ranged from four to seven groups, showing preference to distinguish them by descriptions of laryngeal conditions. Conclusion: There is limited convergence between the different theoretical classifications, which is highlighted by the need to create different subgroups, or categories, to include different vocal disorders. The studies with a computerized approach reduce this variability to a certain extent; however, although promising, they should consider theoretical foundations in the proposition of classifications to be applicable to clinical setting."
Lymph Node Metastasis Prediction From In Situ Lung Squamous Cell Carcinoma Histopathology Images Using Deep Learning.,2025-Jan,"Lu Xia, Tao Xu, Yongsheng Zheng, Baohua Li, Yongfang Ao, Xun Li, Weijing Wu, Jiabian Lian","Lung squamous cell carcinoma (LUSC), a subtype of non-small cell lung cancer, represents a significant portion of lung cancer cases with distinct histologic patterns impacting prognosis and treatment. The current pathological assessment methods face limitations such as interobserver variability, necessitating more reliable techniques. This study seeks to predict lymph node metastasis in LUSC using deep learning models applied to histopathology images of primary tumors, offering a more accurate and objective method for diagnosis and prognosis. Whole slide images (WSIs) from the Outdo-LUSC and the cancer genome atlas cohorts were used to train and validate deep learning models. Multiinstance learning was applied, with patch-level predictions aggregated into WSI-level outcomes. The study employed the ResNet-18 network, transfer learning, and rigorous data preprocessing. To represent WSI features, innovative techniques like patch likelihood histogram and bag of words were used, followed by training of machine learning classifiers, including the ExtraTrees algorithm. The diagnostic model for lymph node metastasis showed strong performance, particularly using the ExtraTrees algorithm, as demonstrated by receiver operating characteristic curves and gradient-weighted class activation mapping visualizations. The signature generated by the ExtraTrees algorithm, named lymph node status-related in situ LUSC histopathology (LN_ISLUSCH), achieved an area under the curve of 0.941 (95% CI: 0.926-0.955) in the training set and 0.788 (95% CI: 0.748-0.827) in the test set. Kaplan-Meier analyses confirmed that the LN_ISLUSCH model was a significant prognostic factor (P = .02). This study underscores the potential of artificial intelligence in enhancing diagnostic precision in pathology. The LN_ISLUSCH model stands out as a promising tool for predicting lymph node metastasis and prognosis in LUSC. Future studies should focus on larger and more diverse cohorts and explore the integration of additional omics data to further refine predictive accuracy and clinical utility."
Subtyping hospitalized patients with hypokalemia by machine learning consensus clustering and associated mortality risks.,2022-Feb,"Charat Thongprayoon, Michael A Mao, Andrea G Kattah, Mira T Keddis, Pattharawin Pattharanitima, Stephen B Erickson, John J Dillon, Vesna D Garovic, Wisit Cheungpasitporn","Hospitalized patients with hypokalemia are heterogeneous and cluster analysis, an unsupervised machine learning methodology, may discover more precise and specific homogeneous groups within this population of interest. Our study aimed to cluster patients with hypokalemia at hospital admission using an unsupervised machine learning approach and assess the mortality risk among these distinct clusters."
