Title,Date,Authors,Abstract
"Antioxidants linked with physical, cognitive and psychological frailty: Analysis of candidate biomarkers and markers derived from the MARK-AGE study.",2019-Jan,"M Liset Rietman, Annemieke M W Spijkerman, Albert Wong, Harry van Steeg, Alexander Bürkle, María Moreno-Villanueva, Thilo Sindlinger, Claudio Franceschi, Beatrix Grubeck-Loebenstein, Jürgen Bernhardt, P Eline Slagboom, Olivier Toussaint, Florence Debacq-Chainiaux, Ewa Sikora, Efstathios S Gonos, Nicolle Breusing, Wolfgang Stuetz, Daniela Weber, Tilman Grune, Andrea Basso, Francesco Piacenza, Marco Malavolta, Sebastiano Collino, Eugene H J M Jansen, W M Monique Verschuren, Martijn E T Dollé","Frailty among elderly people leads to an increased risk for negative health outcomes. To prevent frailty, we need a better understanding of the underlying mechanisms and early detection of individuals at risk. Both may be served by identifying candidate (bio)markers, i.e. biomarkers and markers, for the physical, cognitive, and psychological frailty domains. We used univariate (Rank-ANOVA) and multivariate (elastic net) approaches on the RASIG study population (age range: 35-74 years, n = 2220) of the MARK-AGE study to study up to 331 (bio)markers between individuals with and without frailty for each domain. Biomarkers and markers identified by both approaches were studied further regarding their association with frailty using logistic regression. Univariately, we found lower levels of antioxidants, including β-cryptoxanthin and zeaxanthin, in those who were physically, cognitively or psychologically frail. Additionally, self-reported health was worse in these three frail groups. Multivariately, we observed lower levels of β-cryptoxanthin and zeaxanthin in the cognitively frail. Levels of these carotenoids were inversely associated with the risk of being cognitively frail after adjusting for confounders. Antioxidants and self-reported health are potential (bio)markers to detect persons at risk of becoming frail. The biomarkers identified may indicate the involvement of inflammation in frailty, especially for physical and cognitive frailty."
Wrapper method for feature selection to classify cardiac arrhythmia.,2017-Jul,"Anam Mustaqeem, Syed Muhammad Anwar, Muhammad Majid, Abdul Rashid Khan","Efficient monitoring of cardiac patients can save tremendous amount of lives. Cardiac disease prediction and classification has gained utmost significance in this regard during the past few years. This paper presents a predictive model for classification of arrhythmias. The model works by selecting best features using wrapper algorithm around random forest, followed by implementing various machine learning classifiers on the selected features. Cardiac arrhythmia dataset from University of California, Irvine (UCI) machine learning repository has been used for the experimental purpose. After normalizing the data, repeated cross validation with 10 folds is applied on support vector machine (SVM), K nearest neighbor (KNN), Naïve Bayes, random forest, and Multi-Layer perceptron (MLP). The experimental results demonstrate that MLP beats other classifiers by achieving an average accuracy of 78.26%, while accuracies calculated for KNN and SVM are 76.6% and 74.4% respectively, outperforming the accuracies of previous models."
Comparing assignment-based approaches to breed identification within a large set of horses.,2019-May,"Lenka Putnová, Radek Štohl","Considering the extensive data sets and statistical techniques, animal breeding embodies a branch of machine learning that has a constantly increasing impact on breeding. In our study, information regarding the potential of machine learning and data mining within a large set of horses and breeds is presented. The individual assignment methods and factors influencing the success rate of the procedure are compared at the Czech population scale. The fixation index values ranged from 0.057 (HMS1) to 0.144 (HTG6), and the overall genetic differentiation amounted to 8.9% among the breeds. The highest genetic divergence (F"
Predicting genetic regulatory response using classification.,2004-Aug-04,"Manuel Middendorf, Anshul Kundaje, Chris Wiggins, Yoav Freund, Christina Leslie","Studying gene regulatory mechanisms in simple model organisms through analysis of high-throughput genomic data has emerged as a central problem in computational biology. Most approaches in the literature have focused either on finding a few strong regulatory patterns or on learning descriptive models from training data. However, these approaches are not yet adequate for making accurate predictions about which genes will be up- or down-regulated in new or held-out experiments. By introducing a predictive methodology for this problem, we can use powerful tools from machine learning and assess the statistical significance of our predictions."
Mouse tissue glycome atlas 2022 highlights inter-organ variation in major N-glycan profiles.,2022-Oct-24,"Michiru Otaki, Nozomi Hirane, Yayoi Natsume-Kitatani, Mari Nogami Itoh, Masanori Shindo, Yoichi Kurebayashi, Shin-Ichiro Nishimura","This study presents ""mouse tissue glycome atlas"" representing the profiles of major N-glycans of mouse glycoproteins that may define their essential functions in the surface glycocalyx of mouse organs/tissues and serum-derived extracellular vesicles (exosomes). Cell surface glycocalyx composed of a variety of N-glycans attached covalently to the membrane proteins, notably characteristic ""N-glycosylation patterns"" of the glycocalyx, plays a critical role for the regulation of cell differentiation, cell adhesion, homeostatic immune response, and biodistribution of secreted exosomes. Given that the integrity of cell surface glycocalyx correlates significantly with maintenance of the cellular morphology and homeostatic immune functions, dynamic alterations of N-glycosylation patterns in the normal glycocalyx caused by cellular abnormalities may serve as highly sensitive and promising biomarkers. Although it is believed that inter-organs variations in N-glycosylation patterns exist, information of the glycan diversity in mouse organs/tissues remains to be elusive. Here we communicate for the first-time N-glycosylation patterns of 16 mouse organs/tissues, serum, and serum-derived exosomes of Slc:ddY mice using an established solid-phase glycoblotting platform for the rapid, easy, and high throughput MALDI-TOFMS-based quantitative glycomics. The present results elicited occurrence of the organ/tissue-characteristic N-glycosylation patterns that can be discriminated to each other. Basic machine learning analysis using this N-glycome dataset enabled classification between 16 mouse organs/tissues with the highest F1 score (69.7-100%) when neural network algorithm was used. A preliminary examination demonstrated that machine learning analysis of mouse lung N-glycome dataset by random forest algorithm allows for the discrimination of lungs among the different mouse strains such as the outbred mouse Slc:ddY, inbred mouse DBA/2Crslc, and systemic lupus erythematosus model mouse MRL-lpr/lpr with the highest F1 score (74.5-83.8%). Our results strongly implicate importance of ""human organ/tissue glycome atlas"" for understanding the crucial and diversified roles of glycocalyx determined by the organ/tissue-characteristic N-glycosylation patterns and the discovery research for N-glycome-based disease-specific biomarkers and therapeutic targets."
"Prospective prediction of suicide attempts in community adolescents and young adults, using regression methods and machine learning.",2020-Mar-15,"Marcel Miché, Erich Studerus, Andrea Hans Meyer, Andrew Thomas Gloster, Katja Beesdo-Baum, Hans-Ulrich Wittchen, Roselind Lieb","The use of machine learning (ML) algorithms to study suicidality has recently been recommended. Our aim was to explore whether ML approaches have the potential to improve the prediction of suicide attempt (SA) risk. Using the epidemiological multiwave prospective-longitudinal Early Developmental Stages of Psychopathology (EDSP) data set, we compared four algorithms-logistic regression, lasso, ridge, and random forest-in predicting a future SA in a community sample of adolescents and young adults."
A multi-feature deep learning system to enhance glaucoma severity diagnosis with high accuracy and fast speed.,2022-Dec,"Ying Xue, Jiazhu Zhu, Xiaoling Huang, Xiaobin Xu, Xiaojing Li, Yameng Zheng, Zhijing Zhu, Kai Jin, Juan Ye, Wei Gong, Ke Si","Glaucoma is the leading cause of irreversible blindness, and the early detection and timely treatment are essential for glaucoma management. However, due to the interindividual variability in the characteristics of glaucoma onset, a single feature is not yet sufficient for monitoring glaucoma progression in isolation. There is an urgent need to develop more comprehensive diagnostic methods with higher accuracy. In this study, we proposed a multi- feature deep learning (MFDL) system based on intraocular pressure (IOP), color fundus photograph (CFP) and visual field (VF) to classify the glaucoma into four severity levels. We designed a three-phase framework for glaucoma severity diagnosis from coarse to fine, which contains screening, detection and classification. We trained it on 6,131 samples from 3,324 patients and tested it on independent 240 samples from 185 patients. Our results show that MFDL achieved a higher accuracy of 0.842 (95 % CI, 0.795-0.888) than the direct four classification deep learning (DFC-DL, accuracy of 0.513 [0.449-0.576]), CFP-based single-feature deep learning (CFP-DL, accuracy of 0.483 [0.420-0.547]) and VF-based single-feature deep learning (VF-DL, accuracy of 0.725 [0.668-0.782]). Its performance was statistically significantly superior to that of 8 juniors. It also outperformed 3 seniors and 1 expert, and was comparable with 2 glaucoma experts (0.842 vs 0.854, p = 0.663; 0.842 vs 0.858, p = 0.580). With the assistance of MFDL, junior ophthalmologists achieved statistically significantly higher accuracy performance, with the increased accuracy ranged from 7.50 % to 17.9 %, and that of seniors and experts were 6.30 % to 7.50 % and 5.40 % to 7.50 %. The mean diagnosis time per patient of MFDL was 5.96 s. The proposed model can potentially assist ophthalmologists in efficient and accurate glaucoma diagnosis that could aid the clinical management of glaucoma."
Developing and maintaining clinical decision support using clinical knowledge and machine learning: the case of order sets.,2018-Nov-01,"Yiye Zhang, Richard Trepp, Weiguang Wang, Jorge Luna, David K Vawdrey, Victoria Tiase","Development and maintenance of order sets is a knowledge-intensive task for off-the-shelf machine-learning algorithms alone. We hypothesize that integrating clinical knowledge with machine learning can facilitate effective development and maintenance of order sets while promoting best practices in ordering. To this end, we simulated the revision of an ""AM Lab Order Set"" under 6 revision approaches. Revisions included changes in the order set content or default settings through 1) population statistics, 2) individualized prediction using machine learning, and 3) clinical knowledge. Revision criteria were determined using electronic health record (EHR) data from 2014 to 2015. Each revision's clinical appropriateness, workload from using the order set, and generalizability across time were evaluated using EHR data from 2016 and 2017. Our results suggest a potential order set revision approach that jointly leverages clinical knowledge and machine learning to improve usability while updating contents based on latest clinical knowledge and best practices."
Design and performance analysis of multi-enzyme activity-doped nanozymes assisted by machine learning.,2025-Apr,"Fuguo Ge, Yonghui Gao, Yujie Jiang, Yijie Yu, Qiang Bai, Yun Liu, HuiBin Li, Ning Sui","Traditional design approaches for nanozymes typically rely on empirical methods and trial-and-error, which hampers systematic optimization of their structure and performance, thus limiting the efficiency of developing innovative nanozymes. This study leverages machine learning techniques supported by high-throughput computations to effectively design nanozymes with multi-enzyme activities and to elucidate their reaction mechanisms. Additionally, it investigates the impact of dopants on the microphysical properties of nanozymes. We constructed a machine learning prediction framework tailored for dopant nanozymes exhibiting catalytic activities like to oxidase (OXD) and peroxidase (POD). This framework was used to evaluate key catalytic performance parameters, such as formation energy, density of states (DOS), and adsorption energy, through density functional theory (DFT) calculations. Various machine learning models were employed to predict the effects of different doping element ratios on the catalytic activity and stability of nanozymes. The results indicate that the combination of machine learning with high-throughput computations significantly accelerates the design and optimization of dopant nanozymes, providing an efficient strategy to address the complexities of nanozyme design. This approach not only boosts the efficiency and capability for innovation in material design but also provides a novel theoretical analytical avenue for the development of new functional materials."
"Time-series cardiovascular risk factors and receipt of screening for breast, cervical, and colon cancer: The Guideline Advantage.",2020,"Aixia Guo, Bettina F Drake, Yosef M Khan, James R Langabeer Ii, Randi E Foraker",Cancer is the second leading cause of death in the United States. Cancer screenings can detect precancerous cells and allow for earlier diagnosis and treatment. Our purpose was to better understand risk factors for cancer screenings and assess the effect of cancer screenings on changes of Cardiovascular health (CVH) measures before and after cancer screenings among patients.
Radiomics in surgical oncology: applications and challenges.,2021-Dec,"Travis L Williams, Lily V Saadat, Mithat Gonen, Alice Wei, Richard K G Do, Amber L Simpson","Surgery is a curative treatment option for many patients with malignant tumors. Increased attention has focused on the combination of surgery with chemotherapy, as multimodality treatment has been associated with promising results in certain cancer types. Despite these data, there remains clinical equipoise on optimal timing and patient selection for neoadjuvant or adjuvant strategies. Radiomics, an emerging field involving the extraction of advanced features from radiographic images, has the potential to revolutionize oncologic treatment and contribute to the advance of personalized therapy by helping predict tumor behavior and response to therapy. This review analyzes and summarizes studies that use radiomics with machine learning in patients who have received neoadjuvant and/or adjuvant chemotherapy to predict prognosis, recurrence, survival, and therapeutic response for various cancer types. While studies in both neoadjuvant and adjuvant settings demonstrate above average performance on ability to predict progression-free and overall survival, there remain many challenges and limitations to widespread implementation of this technology. The lack of standardization of common practices to analyze radiomics, limited data sharing, and absence of auto-segmentation have hindered the inclusion and rapid adoption of radiomics in prospective, clinical studies."
The FAIR database: facilitating access to public health research literature.,2024-Dec,"Zhixue Zhao, James Thomas, Gregory Kell, Claire Stansfield, Mark Clowes, Sergio Graziosi, Jeff Brunton, Iain James Marshall, Mark Stevenson","In public health, access to research literature is critical to informing decision-making and to identify knowledge gaps. However, identifying relevant research is not a straightforward task since public health interventions are often complex, can have positive and negative impacts on health inequalities and are applied in diverse and rapidly evolving settings. We developed a ""living"" database of public health research literature to facilitate access to this information using Natural Language Processing tools."
A systematic review of machine learning applications in predicting opioid associated adverse events.,2025-Jan-16,"Carlos R Ramírez Medina, Jose Benitez-Aurioles, David A Jenkins, Meghna Jani","Machine learning has increasingly been applied to predict opioid-related harms due to its ability to handle complex interactions and generating actionable predictions. This review evaluated the types and quality of ML methods in opioid safety research, identifying 44 studies using supervised ML through searches of Ovid MEDLINE, PubMed and SCOPUS databases. Commonly predicted outcomes included postoperative opioid use (n = 15, 34%) opioid overdose (n = 8, 18%), opioid use disorder (n = 8, 18%) and persistent opioid use (n = 5, 11%) with varying definitions. Most studies (96%) originated from North America, with only 7% reporting external validation. Model performance was moderate to strong, but calibration was often missing (41%). Transparent reporting of model development was often incomplete, with key aspects such as calibration, imbalance correction, and handling of missing data absent. Infrequent external validation limited the generalizability of current models. Addressing these aspects is critical for transparency, interpretability, and future implementation of the results."
Medical Doctors' Perceptions of Artificial Intelligence (AI) in Healthcare.,2024-Sep,"Arijita Banerjee, Pradosh Kumar Sarangi, Sumit Kumar","Introduction With the current exponential expansion of robotics, implants, and imaging technologies, diagnostic processes within the healthcare industry are becoming popular platforms for artificial intelligence (AI) use. Thus, an understanding of physicians' attitudes toward AI and the extent to which medical educators are ready to work with AI is necessary. This research aimed to study doctors' perceptions of AI in healthcare. Methods A web-based questionnaire organized into four sections, namely, demographics, concepts of AI, education in AI, and implementation challenges related to AI, was designed systematically based on a literature search and circulated among medical doctors from various fields. Results Study participants exhibited a lower score toward familiarity with AI. Only 52.12% (74/142) of physicians completed the survey. The greatest challenge associated with the use of AI in therapeutic settings was found to be the degree of autonomy, with a score of 3.56. Among the participants, 67.61% felt that the lack of human supervision was the most important limiting factor in the implementation of AI in clinical practice. However, the participants demonstrated a strong interest in understanding the concepts of AI in the near future. Conclusion This study revealed a low degree of familiarity with AI, highlighting the need for medical schools and hospitals to establish specialized education and training programs for physicians to improve patient outcomes."
Rotation Awareness Based Self-Supervised Learning for SAR Target Recognition With Limited Training Samples.,2021,"Zaidao Wen, Zhunga Liu, Shuai Zhang, Quan Pan","The scattering signatures of a synthetic aperture radar (SAR) target image will be highly sensitive to different azimuth angles/poses, which aggravates the demand for training samples in learning-based SAR image automatic target recognition (ATR) algorithms, and makes SAR ATR a more challenging task. This paper develops a novel rotation awareness-based learning framework termed RotANet for SAR ATR under the condition of limited training samples. First, we propose an encoding scheme to characterize the rotational pattern of pose variations among intra-class targets. These targets will constitute several ordered sequences with different rotational patterns via permutations. By further exploiting the intrinsic relation constraints among these sequences as the supervision, we develop a novel self-supervised task which makes RotANet learn to predict the rotational pattern of a baseline sequence and then autonomously generalize this ability to the others without external supervision. Therefore, this task essentially contains a learning and self-validation process to achieve human-like rotation awareness, and it serves as a task-induced prior to regularize the learned feature domain of RotANet in conjunction with an individual target recognition task to improve the generalization ability of the features. Extensive experiments on moving and stationary target acquisition and recognition benchmark database demonstrate the effectiveness of our proposed framework. Compared with other state-of-the-art SAR ATR algorithms, RotANet will remarkably improve the recognition accuracy especially in the case of very limited training samples without performing any other data augmentation strategy."
Computer aided analysis of epi-illumination and transillumination images of skin lesions for diagnosis of skin cancers.,2011,"Brian D'Alessandro, Atam P Dhawan, Nizar Mullani","Skin lesion pigmentation area from surface, or, epi-illumination (ELM) images and blood volume area from transillumination (TLM) images are useful features to aid a dermatologist in the diagnosis of melanoma and other skin cancers in early curable stages. However, segmentation of these areas is difficult. In this work, we present an automatic segmentation tool for ELM and TLM images that also provides additional choices for user selection and interaction with adaptive learning. Our tool uses a combination of k-means clustering, wavelet analysis, and morphological operations to segment the lesion and blood volume, and then presents the user with six segmentation suggestions for both ELM and TLM images. The final selection of segmentation boundary may then be iteratively improved through scoring by multiple users. The ratio of TLM to ELM segmented areas is an indicator of dysplasia in skin lesions for detection of skin cancers, and this ratio is found to show a statistically significant trend in association with lesion dysplasia on a set of 81 pathologically validated lesions (p = 0.0058). We then present a support vector machine classifier using the results from the interactive segmentation method along with ratio, color, texture, and shape features to characterize skin lesions into three degrees of dysplasia with promising accuracy."
What's in the Box?: Uncertain Accountability of Machine Learning Applications in Healthcare.,2020-Nov,"Ma'n Zawati, Michael Lang",No abstract available
Graph Theory-Based Brain Connectivity for Automatic Classification of Multiple Sclerosis Clinical Courses.,2016,"Gabriel Kocevar, Claudio Stamile, Salem Hannoun, François Cotton, Sandra Vukusic, Françoise Durand-Dubief, Dominique Sappey-Marinier",
User-avatar bond as diagnostic indicator for gaming disorder: A word on the side of caution.,2024-Dec-30,"Alexandre Infanti, Alessandro Giardina, Josip Razum, Daniel L King, Stephanie Baggio, Jeffrey G Snodgrass, Matthew Vowels, Adriano Schimmenti, Orsolya Király, Hans-Juergen Rumpf, Claus Vögele, Joël Billieux","In their study, Stavropoulos et al. (2023) capitalized on supervised machine learning and a longitudinal design and reported that the User-Avatar Bond could be accurately employed to detect Gaming Disorder (GD) risk in a community sample of gamers. The authors suggested that the User-Avatar Bond is a ""digital phenotype"" that could be used as a diagnostic indicator for GD risk. In this commentary, our objectives are twofold: (1) to underscore the conceptual challenges of employing User-Avatar Bond for conceptualizing and diagnosing GD risk, and (2) to expound upon what we perceive as a misguided application of supervised machine learning techniques by the authors from a methodological standpoint."
