,titles,dates
1320,"Bayesian linear regression with skew-symmetric error distributions with
  applications to survival analysis",2016-01-10
1321,"Semiparametric Regression Analysis of Interval-Censored Competing Risks
  Data",2016-02-04
1322,"A Semiparametric Joint Model for Terminal Trend of Quality of Life and
  Survival in Palliative Care Research",2016-03-06
1323,Multivariate peaks over thresholds models,2016-03-21
1324,"A Threshold-free Prospective Prediction Accuracy Measure for Censored
  Time to Event Data",2016-06-13
1325,Data Sketching for Large-Scale Kalman Filtering,2016-06-27
1326,"Suppressing escape events in maps of the unit interval with demographic
  noise",2016-07-12
1327,"Instrumental variables estimation of exposure effects on a time-to-event
  response using structural cumulative survival models",2016-08-02
1328,"Modelling Censored Losses Using Splicing: a Global Fit Strategy With
  Mixed Erlang and Extreme Value Distributions",2016-08-04
1329,"A Nonparametric Maximum Likelihood Approach for Partially Observed Cured
  Data with Left Truncation and Right-Censoring",2016-08-31
1330,Generalized Maxwell equations and charge conservation censorship,2016-08-29
1331,"Improved Dynamic Predictions from Joint Models of Longitudinal and
  Survival Data with Time-Varying Effects using P-splines",2016-09-12
1332,"AdaPT: An interactive procedure for multiple testing with side
  information",2016-09-20
1333,"A Few Photons Among Many: Unmixing Signal and Noise for Photon-Efficient
  Active Imaging",2016-09-23
1334,"Bridging Asymptotic Independence and Dependence in Spatial Extremes
  Using Gaussian Scale Mixtures",2016-10-14
1335,Weighted scoring rules and hypothesis testing,2016-11-22
1336,"Nonparametric Tests for Treatment Effect Heterogeneity with Duration
  Outcomes",2016-12-07
1337,"Optimal model averaging forecasting in high-dimensional survival
  analysis",2016-12-26
1338,A New Class of Generalized Burr III Distribution for Lifetime Data,2017-01-02
1339,Playtime Measurement with Survival Analysis,2017-01-04
1340,A General Approach for Cure Models in Survival Analysis,2017-01-13
1341,"Covariant formulation of Aharonov-Bohm electrodynamics and its
  application to coherent tunnelling",2017-02-01
1342,Modeling spatial processes with unknown extremal dependence class,2017-03-17
1343,Patient Observers and Non-perturbative Infrared Dynamics in Inflation,2017-03-29
1344,A geometric approach to non-linear correlations with intrinsic scatter,2017-04-18
1345,"Learning from Clinical Judgments: Semi-Markov-Modulated Marked Hawkes
  Processes for Risk Prognosis",2017-05-15
1346,Permutation Tests for Infection Graphs,2017-05-22
1347,"Exponential error rates of SDP for block models: Beyond Grothendieck's
  inequality",2017-05-23
1348,"A causal approach to analysis of censored medical costs in the presence
  of time-varying treatment",2017-05-24
1349,"Estimation of Genetic Risk Function with Covariates in the Presence of
  Missing Genotypes",2017-05-26
1350,"Bayesian significance test for discriminating between survival
  distributions",2017-05-31
1351,Distributed Detection of Cycles,2017-06-13
1352,"A latent variable model for survival time prediction with censoring and
  diverse covariates",2017-06-21
1353,Stochastic Bandit Models for Delayed Conversions,2017-06-28
1354,Should a Normal Imputation Model Be Modified to Impute Skewed Variables?,2017-07-17
1355,"Exotica and the status of the strong cosmic censor conjecture in four
  dimensions",2017-07-28
1356,"Hierarchical space-time modeling of exceedances with an application to
  rainfall data",2017-08-08
1357,"Semiparametric Sieve Maximum Likelihood Estimation Under Cure Model with
  Partly Interval Censored and Left Truncated Data for Application to
  Spontaneous Abortion Data",2017-08-22
1358,Latency Optimal Broadcasting in Noisy Wireless Mesh Networks,2017-08-30
1359,The GENIUS Approach to Robust Mendelian Randomization Inference,2017-09-22
1360,Edina: Building an Open Domain Socialbot with Self-dialogues,2017-09-28
1361,"Local likelihood estimation of complex tail dependence structures,
  applied to U.S. precipitation extremes",2017-10-02
1362,Cox regression analysis with missing covariates via multiple imputation,2017-10-12
1363,Monte Carlo modified profile likelihood in models for clustered data,2018-01-08
1364,"Discrete Weibull generalised additive model: an application to count
  fertility data",2018-01-24
1365,"Parameter and Uncertainty Estimation for Dynamical Systems Using
  Surrogate Stochastic Processes",2018-02-02
1366,The inflated radii of M-dwarfs in the Pleiades,2018-02-12
1367,"Benchmarking Framework for Performance-Evaluation of Causal Inference
  Analysis",2018-02-14
1368,Simple dynamic algorithms for Maximal Independent Set and other problems,2018-04-05
1369,Automated Discovery of Internet Censorship by Web Crawling,2018-04-09
1370,A Scalable Discrete-Time Survival Model for Neural Networks,2018-05-02
1371,Property Testing of Planarity in the CONGEST model,2018-05-27
1372,"Optimal Balancing of Time-Dependent Confounders for Marginal Structural
  Models",2018-06-04
1373,On the heavy-tail behavior of the distributionally robust newsvendor,2018-06-14
1374,On the ranking of Test match batsmen,2018-06-14
1375,Few Throats to Choke: On the Current Structure of the Internet,2018-06-19
1376,"Generalization of LRU Cache Replacement Policy with Applications to
  Video Streaming",2018-06-28
1377,Linear Bandits with Stochastic Delayed Feedback,2018-07-05
1378,Reward Sharing Schemes for Stake Pools,2018-07-30
1379,Where The Light Gets In: Analyzing Web Censorship Mechanisms in India,2018-08-06
1380,Applications of the Fractional-Random-Weight Bootstrap,2018-08-24
1381,Deep Recurrent Survival Analysis,2018-09-07
1382,A Primer on Causality in Data Science,2018-09-07
1383,"Spectrum and Energy Efficient Multiple Access for Detection in Wireless
  Sensor Networks",2018-09-22
1384,"Robust and Efficient Estimation in the Parametric Cox Regression Model
  under Random Censoring",2018-10-06
1385,Deep learning cardiac motion analysis for human survival prediction,2018-10-08
1386,"Fractional Laplacians in bounded domains: Killed, reflected, censored
  and taboo Lévy flights",2018-10-15
1387,"SQUAREM: An R Package for Off-the-Shelf Acceleration of EM, MM and Other
  EM-like Monotone Algorithms",2018-10-26
1388,Joint Concordance Index,2018-10-26
1389,New Spacetimes for Rotating Dust in (2+1)-Dimensional General Relativity,2018-10-29
1390,The Sparsest Additive Spanner via Multiple Weighted BFS Trees,2018-11-05
1391,"A spatially varying change points model for monitoring glaucoma
  progression using visual field data",2018-11-27
1392,A search for radius inflation among active M-dwarfs in Praesepe,2018-11-27
1393,"Learning through the Grapevine: The Impact of Noise and the Breadth and
  Depth of Social Networks",2018-12-08
1394,"Accounting for selection bias due to death in estimating the effect of
  wealth shock on cognition for the Health and Retirement Study",2018-12-20
1395,Noise-tolerant fair classification,2019-01-30
1396,"Quantum-corrected black holes and naked singularities in
  (2+1)-dimensions",2019-02-05
1397,"Infer Your Enemies and Know Yourself, Learning in Real-Time Bidding with
  Partially Observable Opponents",2019-02-28
1398,"Causal comparative effectiveness analysis of dynamic continuous-time
  treatment initiation rules with sparsely measured outcomes and death",2019-04-02
1399,"Modeling the Causal Effect of Treatment Initiation Time on Survival:
  Application to HIV/TB Co-infection",2019-04-02
1400,"A Reproducing Kernel Hilbert Space log-rank test for the two-sample
  problem",2019-04-10
1401,"Independence Properties of the Truncated Multivariate Elliptical
  Distributions",2019-04-12
1402,"Achieving the Bayes Error Rate in Synchronization and Block Models by
  SDP, Robustly",2019-04-21
1403,"A penalized likelihood approach for efficiently estimating a partially
  linear additive transformation model with current status data",2019-04-23
1404,"A Bayesian Finite Mixture Model with Variable Selection for Data with
  Mixed-type Variables",2019-05-09
1405,Strong cosmic censorship and topology change in four dimensional gravity,2019-05-10
1406,"Learning in structured MDPs with convex cost functions: Improved regret
  bounds for inventory management",2019-05-10
1407,"Colombian Women's Life Patterns: A Multivariate Density Regression
  Approach",2019-05-17
1408,"Marginalized Frailty-Based Illness-Death Model: Application to the
  UK-Biobank Survival Data",2019-05-27
1409,Encrypted DNS --> Privacy? A Traffic Analysis Perspective,2019-06-24
1410,"Simultaneous Transformation and Rounding (STAR) Models for
  Integer-Valued Data",2019-06-27
1411,"A new reproducing kernel based nonlinear dimension reduction method for
  survival data",2019-09-05
1412,"Regression for Copula-linked Compound Distributions with Applications in
  Modeling Aggregate Insurance Claims",2019-10-13
1413,Continuous and Discrete-Time Survival Prediction with Neural Networks,2019-10-15
1414,"A Semi-parametric Bayesian Approach to Population Finding with
  Time-to-Event and Toxicity Data in a Randomized Clinical Trial",2019-10-27
1415,"Net benefit separation and the determination curve: a probabilistic
  framework for cost-effectiveness estimation",2019-11-29
1416,"Nonparametric analysis of nonhomogeneous multi-state processes based on
  clustered observations",2019-12-01
1417,Inference for Two Lomax Populations Under Joint Type-II Censoring,2019-12-05
1418,"Spatial hierarchical modeling of threshold exceedances using rate
  mixtures",2019-12-10
1419,How India Censors the Web,2019-12-18
1420,"New stochastic highway capacity estimation method and why product limit
  method is unsuitable",2020-03-11
1421,Systematic statistical analysis of microbial data from dilution series,2020-03-19
1422,"A generalised OMP algorithm for feature selection with application to
  gene expression data",2020-04-01
1423,Neural Conditional Event Time Models,2020-04-03
1424,"Causal Effects of Prenatal Drug Exposure on Birth Defects with Missing
  by Terathanasia",2020-04-18
1425,"Cox regression analysis for distorted covariates with an unknown
  distortion function",2020-06-02
1426,Survival regression with accelerated failure time model in XGBoost,2020-06-08
1427,The Generalized Lasso with Nonlinear Observations and Generative Priors,2020-06-22
1428,Modeling semi-competing risks data as a longitudinal bivariate process,2020-07-08
1429,Singular solutions for fractional parabolic boundary value problems,2020-07-27
1430,"merlin: An R package for Mixed Effects Regression for Linear, Nonlinear
  and User-defined models",2020-07-28
1431,Analysis of Left Truncated and Right Censored Competing Risks Data,2020-08-18
1432,Power laws in the Roman Empire: a survival analysis,2020-08-21
1433,Survival Modeling of Suicide Risk with Rare and Uncertain Diagnoses,2020-09-05
1434,A Multimodal Memes Classification: A Survey and Open Research Issues,2020-09-17
1435,"Finite mixture modeling of censored and missing data using the
  multivariate skew-normal distribution",2020-09-22
1436,Multi-Armed Bandits with Censored Consumption of Resources,2020-11-02
1437,Mortality modeling and regression with matrix distributions,2020-11-06
1438,"Semiparametric regression of mean residual life with censoring and
  covariate dimension reduction",2020-11-08
1439,"Handling time-dependent exposures and confounders when estimating
  attributable fractions -- bridging the gap between multistate and
  counterfactual modeling",2020-11-09
1440,Efficient Algorithms for Stochastic Repeated Second-price Auctions,2020-11-10
1441,"A Framework for Mediation Analysis with Multiple Exposures, Multivariate
  Mediators, and Non-Linear Response Models",2020-11-11
1442,Opacity from Loops in AdS,2020-11-12
1443,"Dynamic Risk Prediction Triggered by Intermediate Events Using Survival
  Tree Ensembles",2020-11-14
1444,"Semiparametric inference for the scale-mixture of normal partial linear
  regression model with censored data",2020-11-15
1445,A kernel test for quasi-independence,2020-11-17
1446,"Trial emulation and survival analysis for disease incidence registers: a
  case study on the causal effect of pre-emptive kidney transplantation",2020-11-23
1447,"Truncated, Censored, and Actuarial Payment-type Moments for Robust
  Fitting of a Single-parameter Pareto Distribution",2021-02-19
1448,"Left-censored recurrent event analysis in epidemiological studies: a
  proposal when the number of previous episodes is unknown",2021-02-22
1449,"A multistate approach for mediation analysis in the presence of
  semi-competing risks with application in cancer survival disparities",2021-02-26
1450,"Scalable algorithms for semiparametric accelerated failure time models
  in high dimensions",2021-04-04
1451,"The survival-incorporated median versus the median in the survivors or
  in the always-survivors: What are we measuring? And why?",2021-04-05
1452,"Ethereum Name Service: the Good, the Bad, and the Ugly",2021-04-12
1453,A tractable Bayesian joint model for longitudinal and survival data,2021-04-22
1454,"Ranking of average treatment effects with generalized random forests for
  time-to-event outcomes",2021-04-27
1455,"Dose Finding Studies for Therapies with Late-Onset Toxicities: A
  Comparison Study of Designs",2021-04-30
1456,"When Curation Becomes Creation: Algorithms, Microcontent, and the
  Vanishing Distinction between Platforms and Creators",2021-07-01
1457,Phase Retrieval and Design with Automatic Differentiation,2021-07-02
1458,"One-step TMLE for targeting cause-specific absolute risks and survival
  curves",2021-07-04
1459,"Identifying optimally cost-effective dynamic treatment regimes with a
  Q-learning approach",2021-07-07
1460,"On the Selection of Loss Severity Distributions to Model Operational
  Risk",2021-07-08
1461,"A Stochastic Version of the EM Algorithm for Mixture Cure Rate Model
  with Exponentiated Weibull Family of Lifetimes",2021-07-20
1462,Efficient Algorithms for Learning from Coarse Labels,2021-08-22
1463,"L1-regularized neural ranking for risk stratification and its
  application to prediction of time to distant metastasis in luminal node
  negative chemotherapy naïve breast cancer patients",2021-08-23
1464,"Improving sandwich variance estimation for marginal Cox analysis of
  cluster randomized trials",2022-03-04
1465,"A Bayesian Precision Response-adaptive Phase II Clinical Trial Design
  for Radiotherapies with Competing Risk Survival Outcomes",2022-03-14
1466,"UEFA EURO 2020: a ""pure game of chance""?",2022-03-14
1467,"Efficient Estimation of the Additive Risks Model for Interval-Censored
  Data",2022-03-18
1468,"Decouple-and-Sample: Protecting sensitive information in task agnostic
  data release",2022-03-17
1469,"Survival Seq2Seq: A Survival Model based on Sequence to Sequence
  Architecture",2022-04-09
1470,"A Unifying Framework for Flexible Excess Hazard Modeling with
  Applications in Cancer Epidemiology",2022-04-11
1471,Specifying Prior Distributions in Reliability Applications,2022-04-12
1472,"A Generalized Block-Iterative Projection Method for the Common Fixed
  Point Problem Induced by Cutters",2022-04-20
1473,"Estimating optimal individualized treatment rules with multistate
  processes",2022-04-20
1474,"An Efficient Approach for Optimizing the Cost-effective Individualized
  Treatment Rule Using Conditional Random Forest",2022-04-23
1475,"Robust inference for non-destructive one-shot device testing under
  step-stress model with exponential lifetimes",2022-04-25
1476,Proximal Causal Inference for Marginal Counterfactual Survival Curves,2022-04-27
1477,Spherical Gravitational Collapse in 4D Einstein-Gauss-Bonnet theory,2022-04-28
1478,On the Use of $L$-functionals in Regression Models,2022-04-28
1479,Distributed Inference for Spatial Extremes Modeling in High Dimensions,2022-04-29
1480,"Order Restricted Inference for Adaptive Progressively Censored Competing
  Risks Data",2022-05-07
1481,On Neumann Type Problems for nonlocal Equations set in a half Space,2011-12-02
1482,Gaussian process regression for survival data with competing risks,2013-12-05
1483,"Combining isotonic regression and EM algorithm to predict genetic risk
  under monotonicity constraint",2014-07-31
1484,"Herschel Far-Infrared Photometry of the Swift Burst Alert Telescope
  Active Galactic Nuclei Sample of the Local Universe. I. PACS Observations",2014-08-25
1485,Mixture models applied to heterogeneous populations,2015-10-10
1486,Similarity-based Random Survival Forest,2019-03-04
1487,"Global solvability of the vacuum Einstein equation and the strong cosmic
  censorship in four dimensions",2019-03-07
1488,"Data-driven Prognostics with Predictive Uncertainty Estimation using
  Ensemble of Deep Ordinal Regression Models",2019-03-23
1489,Analysing Censorship Circumvention with VPNs via DNS Cache Snooping,2019-07-09
1490,"ICLab: A Global, Longitudinal Internet Censorship Measurement Platform",2019-07-09
1491,"Charged Particle Production Rate from Cosmic Censorship in Dilaton Black
  Hole Spacetimes",2019-07-17
1492,Yakovlev Promotion Time Cure Model with Local Polynomial Estimation,2019-11-02
1493,"Weibull Racing Survival Analysis with Competing Events, Left Truncation,
  and Time-varying Covariates",2019-11-02
1494,"Estimation in Weibull Distribution Under Progressively Type-I Hybrid
  Censored Data",2019-11-11
1495,"Deep Multi-task Prediction of Lung Cancer and Cancer-free Progression
  from Censored Heterogenous Clinical Imaging",2019-11-12
1496,Sparse Hopsets in Congested Clique,2019-11-17
1497,"Multicategory Angle-based Learning for Estimating Optimal Dynamic
  Treatment Regimes with Censored Data",2020-01-14
1498,"SZ Scaling Relations of Galaxy Groups and Clusters Near the North
  Ecliptic Pole",2020-01-21
1499,COKE: Communication-Censored Decentralized Kernel Learning,2020-01-28
1500,Bayesian Survival Analysis Using the rstanarm R Package,2020-02-22
1501,"Assessing causal effects in the presence of treatment switching through
  principal stratification",2020-02-27
1502,"Fast Bayesian Inference in Nonparametric Double Additive Location-Scale
  Models With Right- and Interval-Censored Data",2020-05-11
1503,"Inference for a Step-Stress Model With Type-II and Progressive Type-II
  Censoring and Lognormally Distributed Lifetimes",2020-05-14
1504,Causal inference for semi-competing risks data,2020-10-09
1505,"The loss optimisation of loan recovery decision times using forecast
  cash flows",2020-10-12
1506,"Chasing Your Long Tails: Differentially Private Prediction in Health
  Care Settings",2020-10-13
1507,Anisotropic Dynamical Horizons Arising in Gravitational Collapse,2020-10-23
1508,Revenue Maximization and Learning in Products Ranking,2020-12-07
1509,Bayesian Conditional Transformation Models,2020-12-20
1510,Socio-demographic study of the exoplanet direct imaging community,2020-12-21
1511,Deep Cox Mixtures for Survival Regression,2021-01-16
1512,"Post-processing numerical weather prediction ensembles for probabilistic
  solar irradiance forecasting",2021-01-17
1513,A regression framework for a probabilistic measure of cost-effectiveness,2021-01-25
1514,"Propensity Score Weighting Analysis of Survival Outcomes Using
  Pseudo-observations",2021-02-28
1515,"Robust Estimation of Loss Models for Lognormal Insurance Payment
  Severity Data",2021-03-02
1516,"Identifying Principal Stratum Causal Effects Conditional on a
  Post-treatment Intermediate Response",2021-03-06
1517,"On a log-symmetric quantile tobit model applied to female labor supply
  data",2021-03-07
1518,"T-SCI: A Two-Stage Conformal Inference Algorithm with Guaranteed
  Coverage for Cox-MLP",2021-03-08
1519,"Left-Truncated Health Insurance Claims Data: Theoretical Review and
  Empirical Application",2021-03-09
1520,"Optimal stratification of survival data via Bayesian nonparametric
  mixtures",2021-03-16
1521,"Incorporating delayed entry into the joint frailty model for recurrent
  events and a terminal event",2021-03-26
1522,Bayesian Inference of a Dependent Competing Risk Data,2021-05-01
1523,"Bayesian spatio-temporal model for high-resolution short-term
  forecasting of precipitation fields",2021-05-07
1524,"Asymptotic Properties of Penalized Spline Estimators in Concave Extended
  Linear Models: Rates of Convergence",2021-05-13
1525,"Failure Tolerance of the Human Lumbar Spine in Combined Compression and
  Flexion Loading",2021-05-25
1526,"A consistent nonparametric test of the effect of dementia duration on
  mortality",2021-06-07
1527,"Dependent Dirichlet Processes for Analysis of a Generalized Shared
  Frailty Model",2021-09-08
1528,"Semi-parametric estimation of the EASI model: Welfare implications of
  taxes identifying clusters due to unobserved preference heterogeneity",2021-09-16
1529,"Deep Bayesian Estimation for Dynamic Treatment Regimes with a Long
  Follow-up Time",2021-09-20
1530,"Non-destructive methods for assessing tree fiber length distributions in
  standing trees",2021-09-27
1531,"Parametric study of E. coli incidence with reference to the New Zealand
  freshwater standards and the Manawatū-Whanganui region",2021-10-05
1532,"Toward Uncensorable, Anonymous and Private Access Over Satoshi
  Blockchains",2021-10-16
1533,Critiquing-based Modeling of Subjective Preferences,2021-10-22
1534,"Look behind the Censorship: Reposting-User Characterization and
  Muted-Topic Restoration",2021-10-22
1535,Adaptive Data Debiasing through Bounded Exploration,2021-10-25
1536,"SurvITE: Learning Heterogeneous Treatment Effects from Time-to-Event
  Data",2021-10-26
1537,On Componental Operators in Hilbert Space,2021-11-04
1538,Causal Mediation and Sensitivity Analysis for Mixed-Scale Data,2021-11-06
1539,"An Augmented Likelihood Approach for the Discrete Proportional Hazards
  Model Using Auxiliary and Validated Outcome Data -- with Application to the
  HCHS/SOL Study",2021-11-24
1540,A framework for meta-analysis through standardized survival curves,2021-11-25
1541,"Identification of Bias Against People with Disabilities in Sentiment
  Analysis and Toxicity Detection Models",2021-11-25
1542,Ensuring valid inference for hazard ratios after variable selection,2021-11-30
1543,Utilizing Expert Opinion to inform Extrapolation of Survival Models,2021-12-04
1544,"Do explanations increase the effectiveness of AI-crowd generated fake
  news warnings?",2021-12-07
1545,"Analyzing Highly Correlated Chemical Toxicants Associated with Time to
  Pregnancy Using Discrete Survival Frailty Modeling Via Elastic Net",2021-12-06
1546,Zero-inflated Beta distribution regression modeling,2021-12-14
1547,"Doubly Robust Estimation of the Hazard Difference for Competing Risks
  Data",2021-12-17
1548,"Variational Bayes for high-dimensional proportional hazards models with
  applications within gene expression",2021-12-19
1549,"Efficient Estimation of the Maximal Association between Multiple
  Predictors and a Survival Outcome",2021-12-21
1550,BITES: Balanced Individual Treatment Effect for Survival data,2022-01-05
1551,Bayesian Covariance Structure Modeling of Multi-Way Nested Data,2022-01-25
1552,"Detection of Increased Time Intervals of Anti-Vaccine Tweets for
  COVID-19 Vaccine with BERT Model",2022-01-12
1553,"Measuring the Accessibility of Domain Name Encryption and Its Impact on
  Internet Filtering",2022-02-01
1554,"A sensitivity analysis approach for the causal hazard ratio in
  randomized and observational studies",2022-02-24
1555,Quantum Complexity of Weighted Diameter and Radius in CONGEST Networks,2022-06-06
1556,"Deep Neural Network Based Accelerated Failure Time Models using Rank
  Loss",2022-06-13
1557,"Human lumbar spine injury risk in dynamic combined compression and
  flexion loading",2022-06-13
1558,"A Bayesian Nonparametric Approach for Identifying Differentially
  Abundant Taxa in Multigroup Microbiome Data with Covariates",2022-06-21
1559,Joint lifetime modelling with matrix distributions,2022-07-04
1560,"Accurate RNA 3D structure prediction using a language model-based deep
  learning approach",2022-07-04
1561,"Ensemble feature selection with data-driven thresholding for Alzheimer's
  disease biomarker discovery",2022-07-05
1562,"Addressing Detection Limits with Semiparametric Cumulative Probability
  Models",2022-07-06
1563,LIP: Lightweight Intelligent Preprocessor for meaningful text-to-speech,2022-07-11
1564,Lapse risk modelling in insurance: a Bayesian mixture approach,2022-07-14
1565,Treatment Heterogeneity for Survival Outcomes,2022-07-15
1566,Softening online extremes organically and at scale,2022-05-29
1567,"Traditional kriging versus modern Gaussian processes for large-scale
  mining data",2022-07-20
1568,"Inferring random change point from left-censored longitudinal data by
  segmented mechanistic nonlinear models, with application in HIV surveillance
  study",2022-08-02
1569,Transformation models for ROC analysis,2022-08-07
1570,Distribution-Free Location-Scale Regression,2022-08-10
1571,"Doubly Robust Estimation under Covariate-Induced Dependent Left
  Truncation",2022-08-14
1572,Deep Learning-Based Discrete Calibrated Survival Prediction,2022-08-17
1573,Inferring Sensitive Attributes from Model Explanations,2022-08-21
1574,Price of MEV: Towards a Game Theoretical Approach to MEV,2022-08-29
1575,Better Peer Grading through Bayesian Inference,2022-09-02
1576,"A New Integrative Method for Multigroup Comparisons of Censored Survival
  Outcomes in Multiple Observational Studies",2022-09-14
1577,Proofs of Proof-of-Stake with Sublinear Complexity,2022-09-18
1578,"Efficient and accurate inference for mixtures of Mallows models with
  Spearman distance",2022-09-20
1579,Factor-Augmented Regularized Model for Hazard Regression,2022-10-03
1580,"Transporting survival of an HIV clinical trial to the external target
  populations",2022-10-05
